Acci蚤;Date;Usuaio
"Se guardo la ruta R011";"10/08/2019 13:16:02";zamo
"Se guardo la ruta R012";"12/08/2019 13:05:56";zamo
"Se abrio el formulario de Add_conductor ";"12/08/2019 13:08:59";
"Se abrio el formulario de Add_conductor ";"12/08/2019 13:09:34";zamo
"Se abrio el formulario de Add_conductor ";"12/08/2019 13:15:19";zamo
"Se abrio el formulario de Add_conductor ";"12/08/2019 13:24:32";zamo
"Se guardo la ruta Sin Ruta";"12/08/2019 13:26:57";zamo
"Se abrio el formulario de Add_conductor ";"12/08/2019 13:27:01";zamo
"Se abrio el formulario de Add_conductor ";"12/08/2019 13:27:44";zamo
"Se abrio el formulario de Add_conductor ";"12/08/2019 13:37:18";zamo
"Se abrio el formulario de Add_conductor ";"12/08/2019 13:41:07";zamo
"Se abrio el formulario de Add_conductor ";"12/08/2019 13:42:30";zamo
"Se abrio el formulario de Add_conductor ";"12/08/2019 13:45:01";zamo
"Se abrio el formulario de Add_conductor ";"12/08/2019 13:47:04";zamo
"Se abrio el formulario de Add_conductor ";"12/08/2019 13:50:44";zamo
"Se abrio el formulario de Add_conductor ";"12/08/2019 13:51:37";zamo
"Se abrio el formulario de Add_conductor ";"12/08/2019 13:52:48";zamo
"Se guardo al conductor Cesar Samuel Rodriguez Hernandez";"12/08/2019 13:53:11";zamo
"Se abrio el formulario de Add_conductor ";"12/08/2019 13:56:19";zamo
"Se guardo al conductor Cesar Samuel Rodriguez Hernandez";"2019/08/12 13:56:39";zamo
"Se abrio el formulario de Add_conductor ";"12/08/2019 13:57:51";zamo
"Se abrio el formulario de Add_conductor ";"12/08/2019 13:58:07";zamo
"Se abrio el formulario de Add_conductor ";"12/08/2019 13:58:18";zamo
"Se abrio el formulario de Add_conductor ";"12/08/2019 13:59:33";zamo
"Se guardo al conductor Cesar Samuel Rodriguez Hernandez";"2019/08/12 13:59:58";zamo
"Se abrio el formulario de Add_conductor ";"12/08/2019 14:40:14";zamo
"Se abrio el formulario de Add_conductor ";"12/08/2019 16:53:02";zamo
"No se logro guardar al conductor  Cesar Samuel Rodriguez Hernandez por algun problema";"2019/08/12 16:53:30";zamo
"Se abrio el formulario de Add_conductor ";"12/08/2019 16:59:09";zamo
"No se logro guardar al conductor  Samuel por algun problema";"2019/08/12 16:59:22";zamo
"Se abrio el formulario de Add_conductor ";"12/08/2019 17:01:54";zamo
"No se logro guardar al conductor  asdas por algun problema";"2019/08/12 17:02:03";zamo
"No se logro guardar al conductor  asdas por algun problema";"2019/08/12 17:05:12";zamo
"No se logro guardar al conductor  asdas por algun problema";"2019/08/12 17:21:25";zamo
"Se guardo al conductor asdas y se asigno la ruta asdas";"2019/08/12 17:22:24";zamo
"Se abrio el formulario de Add_conductor ";"12/08/2019 17:27:38";zamo
"Se guardo al conductor Cesar Samuel y se asigno la ruta 2";"2019/08/12 17:27:56";zamo
"Se abrio el formulario de Add_conductor ";"12/08/2019 17:29:30";zamo
"Se abrio el formulario de Add_Unidad ";"12/08/2019 17:41:41";zamo
"Se abrio el formulario de Add_Unidad ";"12/08/2019 17:42:19";zamo
"Se abrio el formulario de Add_Unidad ";"12/08/2019 17:42:22";zamo
"Se abrio el formulario de Add_conductor ";"12/08/2019 17:42:26";zamo
"Se abrio el formulario de Add_Unidad ";"12/08/2019 17:48:36";zamo
"Se abrio el formulario de Add_conductor ";"12/08/2019 17:48:42";zamo
"Se abrio el formulario de Add_conductor ";"12/08/2019 17:49:50";zamo
"Se guardo al conductor Cesar Samuel Rodriguez Hernandez y se asigno la ruta 1";"2019/08/12 17:50:17";zamo
"Se abrio el formulario de Add_conductor ";"12/08/2019 17:51:19";zamo
"Se guardo al conductor Angelica Moreno y se asigno la ruta 1";"2019/08/12 17:51:30";zamo
"Se abrio el formulario de Add_Unidad ";"12/08/2019 17:52:01";zamo
"Se abrio el formulario de Add_Unidad ";"12/08/2019 17:53:17";zamo
"Se abrio el formulario de Add_Unidad ";"12/08/2019 17:55:17";zamo
"Se abrio el formulario de Add_conductor ";"12/08/2019 17:55:32";zamo
"Se guardo la ruta Promotoria";"12/08/2019 17:56:36";zamo
"Se abrio el formulario de Add_conductor ";"12/08/2019 17:56:43";zamo
"Se guardo al conductor Raul y se asigno la ruta 2";"2019/08/12 17:57:10";zamo
"Se abrio el formulario de Add_Unidad ";"12/08/2019 17:57:16";zamo
"Se abrio el formulario de Add_conductor ";"12/08/2019 17:58:53";zamo
"Se abrio el formulario de Add_conductor ";"13/08/2019 07:46:15";zamo
"Se abrio el formulario de Add_Unidad ";"13/08/2019 07:52:36";zamo
"Se abrio el formulario de Add_conductor ";"13/08/2019 08:00:35";zamo
"Se abrio el formulario de Add_conductor ";"13/08/2019 08:00:35";zamo
"Se abrio el formulario de Add_conductor ";"13/08/2019 08:00:54";zamo
"Se abrio el formulario de Add_conductor ";"13/08/2019 08:00:54";zamo
"Se abrio el formulario de Add_conductor ";"13/08/2019 08:01:51";zamo
"Se abrio el formulario de Add_conductor ";"13/08/2019 08:09:21";zamo
"Se abrio el formulario de Add_Unidad ";"13/08/2019 09:37:07";zamo
"Se abrio el formulario de Add_Unidad ";"13/08/2019 09:37:51";zamo
"Se abrio el formulario de Add_Unidad ";"13/08/2019 09:38:10";zamo
"Se abrio el formulario de Add_Unidad ";"13/08/2019 09:39:34";zamo
"Se abrio el formulario de Add_Unidad ";"13/08/2019 09:42:10";zamo
"Se abrio el formulario de Add_Unidad ";"13/08/2019 10:19:11";zamo
"Se abrio el formulario de Add_Unidad ";"13/08/2019 10:25:21";zamo
"Se abrio el formulario de Add_Unidad ";"13/08/2019 10:25:58";zamo
"Se abrio el formulario de Add_Unidad ";"13/08/2019 11:27:59";zamo
"Se abrio el formulario de Add_Unidad ";"13/08/2019 11:32:08";zamo
"Se abrio el formulario de Add_Unidad ";"13/08/2019 11:37:54";zamo
"Se abrio el formulario de Add_Unidad ";"13/08/2019 11:40:28";zamo
"Se abrio el formulario de Add_Unidad ";"13/08/2019 11:44:42";zamo
"Se abrio el formulario de Add_Unidad ";"13/08/2019 11:44:57";zamo
"Se abrio el formulario de Add_Unidad ";"13/08/2019 11:46:01";zamo
"Se guardo la Unidad 27";"2019/08/13 11:46:30";zamo
"Se abrio el formulario de Add_conductor ";"13/08/2019 11:46:48";zamo
"Se abrio el formulario de Add_conductor ";"13/08/2019 11:48:03";zamo
"Se abrio el formulario de Add_conductor ";"13/08/2019 11:50:54";zamo
"Se guardo al conductor Cesar Samuel Rodriguez Hernandez y se asigno la ruta 2";"2019/08/13 11:51:20";zamo
"Se abrio el formulario de Add_conductor ";"13/08/2019 12:04:04";Sandra
"Se abrio el formulario de Add_Unidad ";"13/08/2019 12:06:11";Sandra
"Se abrio el formulario de Add_conductor ";"13/08/2019 12:10:25";Sandra
"Se abrio el formulario de Add_conductor ";"13/08/2019 12:11:30";Sandra
"Se abrio el formulario de Add_Unidad ";"13/08/2019 12:12:31";Sandra
"Se abrio el formulario de Add_conductor ";"13/08/2019 12:12:59";Sandra
"Se abrio el formulario de Add_Unidad ";"13/08/2019 12:15:21";Sandra
"Se abrio el formulario de Add_conductor ";"13/08/2019 12:15:29";Sandra
"Se abrio el formulario de Add_Unidad ";"13/08/2019 12:15:31";Sandra
"Se abrio el formulario de Add_conductor ";"13/08/2019 12:15:46";Sandra
"Se abrio el formulario de Add_conductor ";"13/08/2019 12:15:58";Sandra
"Se abrio el formulario de Add_Unidad ";"13/08/2019 12:29:41";zamo
"Se abrio el formulario de Add_Unidad ";"13/08/2019 12:40:55";zamo
"Se abrio el formulario de Add_Unidad ";"13/08/2019 13:08:42";zamo
"Se abrio el formulario de Add_Unidad ";"13/08/2019 13:09:57";zamo
"Se abrio el formulario de Add_Unidad ";"13/08/2019 13:10:19";zamo
"Se abrio el formulario de Add_Unidad ";"13/08/2019 13:11:42";zamo
"Se abrio el formulario de Add_Unidad ";"13/08/2019 13:20:43";Sandra
"Se guardo la Unidad 7";"2019/08/13 13:24:49";Sandra
"Se abrio el formulario de Add_conductor ";"13/08/2019 13:24:57";Sandra
"Se abrio el formulario de Add_Ruta ";"13/08/2019 15:19:14";zamo
"Se abrio el formulario de Add_Ruta ";"13/08/2019 15:30:33";zamo
"Se abrio el formulario de Add_conductor ";"13/08/2019 15:30:38";zamo
"Se guardo al conductor Prueba y se asigno la ruta 1";"2019/08/13 15:30:54";zamo
"Se abrio el formulario de Add_Ruta ";"13/08/2019 15:30:57";zamo
"No se logro guardar la ruta  prueba por algun problema en el conductor";"13/08/2019 15:31:07";zamo
"Se abrio el formulario de Add_Ruta ";"13/08/2019 15:51:25";zamo
"Se abrio el formulario de Add_Ruta ";"13/08/2019 15:52:04";zamo
"Se guardo la ruta Prueba";"13/08/2019 15:52:10";zamo
"Se abrio el formulario de Add_Ruta ";"13/08/2019 15:52:19";zamo
"Se abrio el formulario de Add_Unidad ";"13/08/2019 17:58:20";zamo
"Se abrio el formulario de Add_Unidad ";"14/08/2019 10:11:31";zamo
"Se abrio el formulario de Add_Unidad ";"14/08/2019 10:59:40";zamo
"Se abrio el formulario de Add_Unidad ";"14/08/2019 11:08:59";zamo
"Se abrio el formulario de Add_conductor ";"14/08/2019 11:39:39";zamo
"Se guardo al conductor Prueba y se asigno la ruta 1";"2019/08/14 11:40:29";zamo
"Se abrio el formulario de Add_Unidad ";"14/08/2019 11:41:29";zamo
"Se abrio el formulario de Add_Unidad ";"14/08/2019 11:42:22";zamo
"Se abrio el formulario de Add_Unidad ";"14/08/2019 11:44:26";zamo
"Se guardo la Unidad Prueba";"2019/08/14 11:44:44";zamo
"Se abrio el formulario de Add_conductor ";"14/08/2019 12:52:36";zamo
"Se abrio el formulario de Add_Unidad ";"14/08/2019 12:53:08";zamo
"Se abrio el formulario de Add_Ruta ";"14/08/2019 12:53:11";zamo
"Se abrio el formulario de Add_Unidad ";"14/08/2019 17:02:04";zamo
"Se abrio el formulario de Add_conductor ";"14/08/2019 17:50:25";zamo
"Se abrio el formulario de Add_conductor ";"14/08/2019 17:51:13";zamo
"Se guardo al conductor Prueba 2 y se asigno la ruta 1";"2019/08/14 17:51:34";zamo
"Se abrio la lista de Unidades ";"14/08/2019 17:57:10";zamo
"Se abrio la lista de Conductores ";"14/08/2019 17:58:38";zamo
"Se abrio la lista de Conductores ";"14/08/2019 17:59:02";zamo
"Se abrio la lista de Conductores ";"14/08/2019 17:59:21";zamo
"Se abrio la lista de Unidades ";"15/08/2019 07:57:36";zamo
"Se abrio la lista de Conductores ";"15/08/2019 07:57:46";zamo
"Se abrio la lista de Conductores ";"15/08/2019 10:51:40";zamo
"Se abrio la lista de Conductores ";"15/08/2019 10:57:23";zamo
"Se abrio la lista de Conductores ";"15/08/2019 16:09:18";zamo
"Se abrio la lista de Conductores ";"15/08/2019 16:13:56";zamo
"Se abrio la lista de Conductores ";"15/08/2019 16:19:08";zamo
"Se abrio la lista de Conductores ";"15/08/2019 16:19:28";zamo
"Se abrio la lista de Conductores ";"15/08/2019 16:20:04";zamo
"Se abrio la lista de Conductores ";"15/08/2019 16:20:38";zamo
"Se abrio la lista de Conductores ";"15/08/2019 16:21:16";zamo
"Se abrio la lista de Conductores ";"15/08/2019 16:27:19";zamo
"Se abrio la lista de Conductores ";"15/08/2019 16:31:36";zamo
"Se abrio la lista de Conductores ";"15/08/2019 16:32:02";zamo
"Se abrio la lista de Conductores ";"15/08/2019 16:35:24";zamo
"Se abrio la lista de Conductores ";"15/08/2019 17:21:51";zamo
"Se abrio la lista de Conductores ";"15/08/2019 17:31:10";zamo
"Se abrio la lista de Conductores ";"15/08/2019 17:32:12";zamo
"Se abrio la lista de Conductores ";"15/08/2019 17:43:42";zamo
"Se abrio la lista de Conductores ";"15/08/2019 17:45:04";zamo
"Se abrio la lista de Conductores ";"15/08/2019 17:49:24";zamo
"Se guardo la ruta Prueba";"15/08/2019 17:49:27";zamo
"Se abrio la lista de Conductores ";"15/08/2019 17:49:34";zamo
"Se abrio la lista de Conductores ";"15/08/2019 17:50:43";zamo
"Se guardo la ruta Prueba";"15/08/2019 17:50:50";zamo
"Se abrio la lista de Conductores ";"15/08/2019 17:51:33";zamo
"Se abrio la lista de Conductores ";"15/08/2019 17:51:56";zamo
"Se guardo la ruta Prueba";"15/08/2019 17:52:02";zamo
"Se abrio la lista de Conductores ";"15/08/2019 17:52:02";zamo
"Se abrio la lista de Conductores ";"15/08/2019 17:53:04";zamo
"Se abrio la lista de Conductores ";"15/08/2019 17:53:15";zamo
"Se guardo la ruta Prueba";"15/08/2019 17:53:18";zamo
"Se abrio la lista de Conductores ";"15/08/2019 17:53:18";zamo
"Se abrio la lista de Conductores ";"15/08/2019 17:53:32";zamo
"Se abrio la lista de Conductores ";"15/08/2019 17:54:44";Sandra
"No se logro eliminar al conductor  Prueba por algun problema";"15/08/2019 17:56:10";Sandra
"No se logro eliminar al conductor  Prueba por algun problema";"15/08/2019 17:56:45";Sandra
"Se abrio la lista de Conductores ";"15/08/2019 17:58:24";zamo
"Se abrio la lista de Conductores ";"15/08/2019 17:58:33";zamo
"Se abrio la lista de Conductores ";"15/08/2019 17:59:27";zamo
"Se abrio la lista de Conductores ";"15/08/2019 17:59:31";zamo
"Se abrio la lista de Conductores ";"15/08/2019 17:59:43";zamo
"Se abrio la lista de Conductores ";"15/08/2019 17:59:56";zamo
"Se abrio la lista de Conductores ";"15/08/2019 18:00:50";zamo
"Se elimino al conductor Prueba";"15/08/2019 18:00:52";zamo
"Se abrio la lista de Conductores ";"15/08/2019 18:00:52";zamo
"Se abrio la lista de Conductores ";"16/08/2019 09:10:13";zamo
"Se abrio la lista de Conductores ";"16/08/2019 09:10:43";zamo
"Inicio Sesion el usuario Sandra Rosas";"2019/08/16 09:18:04";"Sandra Rosas"
"Inicio Sesion el usuario Cesar Samuel Rodriguez Hernandez";"2019/08/16 09:18:14";"Cesar Samuel Rodriguez Hernandez"
"Se abrio la lista de Conductores ";"16/08/2019 10:21:14";zamo
"Se abrio la lista de Conductores ";"16/08/2019 10:21:21";zamo
"Se elimino al conductor Prueba 2";"16/08/2019 10:21:24";zamo
"Se abrio la lista de Conductores ";"16/08/2019 10:21:24";zamo
"Se abrio la lista de Conductores ";"16/08/2019 10:21:27";zamo
"Se abrio la lista de Conductores ";"16/08/2019 10:23:33";zamo
"Se abrio la lista de Conductores ";"16/08/2019 10:25:36";zamo
"Se abrio la lista de Conductores ";"16/08/2019 10:27:07";zamo
"Se abrio la lista de Conductores ";"16/08/2019 10:27:35";zamo
"Se abrio la lista de Conductores ";"16/08/2019 10:32:16";zamo
"Se abrio la lista de Conductores ";"16/08/2019 10:32:23";zamo
"Se abrio la lista de Conductores ";"16/08/2019 10:32:28";zamo
"Se abrio la lista de Conductores ";"16/08/2019 10:32:49";zamo
"Se abrio la lista de Conductores ";"16/08/2019 10:36:10";zamo
"Se Restauro al conductor Prueba 2";"16/08/2019 10:36:12";zamo
"Se abrio la lista de Conductores ";"16/08/2019 10:36:12";zamo
"Se abrio la lista de Conductores ";"16/08/2019 10:36:28";zamo
"Se elimino al conductor Prueba 2";"16/08/2019 10:36:33";zamo
"Se abrio la lista de Conductores ";"16/08/2019 10:36:33";zamo
"Se abrio la lista de Conductores ";"16/08/2019 10:36:49";zamo
"Se abrio la lista de Conductores ";"16/08/2019 10:36:50";zamo
"Se abrio la lista de Conductores ";"16/08/2019 10:37:23";zamo
"Se abrio la lista de Conductores ";"16/08/2019 11:11:30";zamo
"No se logro borrar al conductor  Prueba 2 por ingreso incorrecto de contrase침a";"16/08/2019 11:11:40";zamo
"Se abrio la lista de Conductores ";"16/08/2019 11:11:46";zamo
"Se abrio la lista de Conductores ";"16/08/2019 11:13:55";zamo
"No se logro borrar al conductor  Prueba 2 por ingreso incorrecto de contrase침a";"16/08/2019 11:14:00";zamo
"Se abrio la lista de Conductores ";"16/08/2019 11:14:22";zamo
"Se abrio la lista de Conductores ";"16/08/2019 11:14:24";zamo
"No se logro borrar al conductor  Prueba 2 por ingreso incorrecto de contrase침a";"16/08/2019 11:14:29";zamo
"Se abrio la lista de Conductores ";"16/08/2019 11:15:52";zamo
"No se logro borrar al conductor  Prueba 2 por ingreso incorrecto de contrase침a";"16/08/2019 11:15:56";zamo
"Se abrio la lista de Conductores ";"16/08/2019 11:16:23";zamo
"No se logro borrar al conductor  Prueba 2 por ingreso incorrecto de contrase침a";"16/08/2019 11:16:27";zamo
"Se abrio la lista de Conductores ";"16/08/2019 11:17:03";zamo
"No se logro borrar al conductor  Prueba 2 por ingreso incorrecto de contrase침a";"16/08/2019 11:17:08";zamo
"Se abrio la lista de Conductores ";"16/08/2019 11:17:15";zamo
"Se abrio la lista de Conductores ";"16/08/2019 11:18:31";zamo
"Se Elimino Permanentemente al conductor Prueba 2";"16/08/2019 11:18:37";zamo
"Se abrio la lista de Conductores ";"16/08/2019 11:18:37";zamo
"Se abrio la lista de Conductores ";"16/08/2019 11:18:42";zamo
"Se abrio la lista de Conductores ";"16/08/2019 11:19:06";zamo
"Se abrio la lista de Conductores ";"16/08/2019 11:19:09";zamo
"Se elimino al conductor Prueba";"16/08/2019 11:19:11";zamo
"Se abrio la lista de Conductores ";"16/08/2019 11:19:11";zamo
"Se abrio la lista de Conductores ";"16/08/2019 11:19:14";zamo
"Se Restauro al conductor Prueba";"16/08/2019 11:19:16";zamo
"Se abrio la lista de Conductores ";"16/08/2019 11:19:16";zamo
"Se abrio la lista de Conductores ";"16/08/2019 11:19:20";zamo
"Se elimino al conductor Prueba";"17/08/2019 08:32:59";zamo
"Se abrio la lista de Conductores ";"17/08/2019 08:33:00";zamo
"Se abrio la lista de Conductores ";"17/08/2019 08:33:03";zamo
"Se Restauro al conductor Prueba";"17/08/2019 08:33:06";zamo
"Se abrio la lista de Conductores ";"17/08/2019 08:33:06";zamo
"Se abrio la lista de Conductores ";"17/08/2019 08:33:11";zamo
"Se abrio el formulario de Add_Unidad ";"17/08/2019 08:33:17";zamo
"Se abrio la lista de Conductores ";"17/08/2019 08:33:23";zamo
"Se elimino al conductor Prueba";"17/08/2019 08:33:25";zamo
"Se abrio la lista de Conductores ";"17/08/2019 08:33:25";zamo
"Se abrio el formulario de Add_Unidad ";"17/08/2019 08:33:30";zamo
"Se abrio la lista de Conductores ";"19/08/2019 08:25:36";zamo
"Se Restauro al conductor Prueba";"19/08/2019 08:25:42";zamo
"Se abrio la lista de Conductores ";"19/08/2019 08:25:42";zamo
"Se abrio la lista de Conductores ";"19/08/2019 08:25:46";zamo
"Se abrio el formulario de Add_Unidad ";"19/08/2019 08:25:48";zamo
"Se abrio el formulario de Add_conductor ";"19/08/2019 12:51:23";zamo
"Inicio Sesion el usuario Sandra Rosas";"2019/08/19 15:31:57";"Sandra Rosas"
"Se abrio la lista de Unidades ";"19/08/2019 15:32:04";Sandra
"Se abrio la lista de Conductores ";"19/08/2019 15:32:16";Sandra
"Se elimino al conductor Prueba";"19/08/2019 15:32:21";Sandra
"Se abrio la lista de Conductores ";"19/08/2019 15:32:21";Sandra
"Se abrio el formulario de Add_Unidad ";"19/08/2019 15:32:24";Sandra
"Inicio Sesion el usuario Cesar Samuel Rodriguez Hernandez";"2019/08/19 15:32:35";"Cesar Samuel Rodriguez Hernandez"
"Se abrio la lista de Conductores ";"19/08/2019 15:32:40";zamo
"Se abrio la lista de Conductores ";"19/08/2019 15:32:40";zamo
"Se Restauro al conductor Prueba";"19/08/2019 15:32:45";zamo
"Se abrio la lista de Conductores ";"19/08/2019 15:32:45";zamo
"Se abrio el formulario de Add_Unidad ";"19/08/2019 15:32:50";zamo
"Se abrio la lista de Conductores ";"19/08/2019 15:32:59";zamo
"Se abrio la lista de Conductores ";"19/08/2019 15:32:59";zamo
"Se abrio la lista de Conductores ";"19/08/2019 15:33:02";zamo
"Se elimino al conductor Prueba";"19/08/2019 15:33:05";zamo
"Se abrio la lista de Conductores ";"19/08/2019 15:33:05";zamo
"Se abrio la lista de Conductores ";"19/08/2019 15:33:08";zamo
"No se logro borrar al conductor  Prueba por ingreso incorrecto de contrase침a";"19/08/2019 15:33:21";zamo
"Se Restauro al conductor Prueba";"19/08/2019 15:33:52";zamo
"Se abrio la lista de Conductores ";"19/08/2019 15:33:52";zamo
"Se abrio la lista de Conductores ";"19/08/2019 15:34:08";zamo
"Se abrio la lista de Conductores ";"19/08/2019 15:34:42";zamo
"Se abrio la lista de Unidades ";"19/08/2019 15:36:09";zamo
"Se abrio el formulario de Add_conductor ";"19/08/2019 15:43:02";zamo
"Se abrio el formulario de Add_conductor ";"19/08/2019 15:45:21";zamo
"Inicio Sesion el usuario Sandra Rosas";"2019/08/20 10:26:37";"Sandra Rosas"
"Se abrio la lista de Conductores ";"20/08/2019 10:26:49";Sandra
"Se abrio la lista de Unidades ";"20/08/2019 10:27:38";Sandra
"Se abrio la lista de Conductores ";"20/08/2019 10:37:10";Sandra
"Se abrio la lista de Unidades ";"20/08/2019 10:37:23";Sandra
"Inicio Sesion el usuario Sandra Rosas";"2019/08/20 11:15:21";"Sandra Rosas"
"Se abrio el formulario de Add_conductor ";"20/08/2019 12:48:05";zamo
"Se abrio el formulario de Add_conductor ";"20/08/2019 12:48:21";zamo
"Se abrio el formulario de Add_conductor ";"20/08/2019 12:48:36";zamo
"Se abrio el formulario de Add_conductor ";"20/08/2019 12:48:48";zamo
"Se abrio el formulario de Add_Unidad ";"20/08/2019 17:11:29";zamo
0;"2019/08/20 17:31:08";zamo
0;"2019/08/20 17:31:10";zamo
0;"2019/08/20 17:31:38";zamo
0;"2019/08/20 17:32:11";zamo
0;"2019/08/20 17:32:32";zamo
0;"2019/08/20 17:32:34";zamo
0;"2019/08/20 17:38:04";zamo
0;"2019/08/20 17:38:26";zamo
0;"2019/08/20 17:39:54";zamo
0;"2019/08/20 17:41:16";zamo
0;"2019/08/20 17:41:49";zamo
0;"2019/08/20 17:42:26";zamo
0;"2019/08/20 17:42:28";zamo
0;"2019/08/20 17:43:32";zamo
"Inicio Sesion el usuario Sandra Rosas";"2019/08/20 17:45:31";"Sandra Rosas"
"Se guardo la Unidad 2";"2019/08/20 17:56:58";Sandra
"Se abrio el formulario de Add_conductor ";"20/08/2019 17:57:20";Sandra
0;"2019/08/20 17:58:51";zamo
"Inicio seleciono la unidad  2 Para dar una salida";"2019/08/20 17:59:08";zamo
"Se guardo al conductor RAYMUNDO PAZ ONOFRE y se asigno la ruta 1";"2019/08/20 17:59:10";Sandra
"Se abrio el formulario de Add_conductor ";"20/08/2019 17:59:15";Sandra
"Inicio seleciono la unidad  2 Para dar una salida";"2019/08/20 17:59:25";zamo
"Se guardo al conductor JUAN MIGUEL NIEVA y se asigno la ruta 1";"2019/08/20 17:59:45";Sandra
"Se abrio el formulario de Add_conductor ";"20/08/2019 17:59:50";Sandra
"Se guardo al conductor JOSE MARCOS VAZQUEZ y se asigno la ruta 1";"2019/08/20 18:00:42";Sandra
"Se abrio el formulario de Add_Ruta ";"20/08/2019 18:00:56";Sandra
"Se guardo la ruta R011";"20/08/2019 18:01:22";Sandra
"Se guardo la ruta R012";"20/08/2019 18:01:33";Sandra
"Se guardo la ruta R013";"20/08/2019 18:01:45";Sandra
"Inicio seleciono la unidad  2 Para dar una salida";"2019/08/20 18:01:46";zamo
"Se guardo la ruta R014";"20/08/2019 18:02:04";Sandra
"Se abrio la lista de Conductores ";"20/08/2019 18:02:09";Sandra
"Inicio seleciono la unidad  2 Para dar una salida";"2019/08/20 18:02:13";zamo
"Se abrio la lista de Conductores ";"20/08/2019 18:02:28";Sandra
"Se abrio el formulario de Add_Ruta ";"20/08/2019 18:02:36";Sandra
"Se guardo la ruta R015";"20/08/2019 18:02:47";Sandra
"Se guardo la ruta R016";"20/08/2019 18:02:58";Sandra
"Se guardo la ruta R017";"20/08/2019 18:03:07";Sandra
"Se guardo la ruta R018";"20/08/2019 18:03:16";Sandra
"Se guardo la ruta R018";"20/08/2019 18:03:28";Sandra
"Inicio seleciono la unidad  2 Para dar una salida";"2019/08/20 18:03:34";zamo
"Se guardo la ruta R021";"20/08/2019 18:03:37";Sandra
"Se guardo la ruta R022";"20/08/2019 18:03:48";Sandra
"Se guardo la ruta R023";"20/08/2019 18:04:05";Sandra
"Se guardo la ruta R024";"20/08/2019 18:04:13";Sandra
"Se guardo la ruta R025";"20/08/2019 18:04:24";Sandra
"Se abrio el formulario de Add_conductor ";"20/08/2019 18:04:38";
"Se guardo al conductor IVAN BRITO y se asigno la ruta 4";"2019/08/20 18:05:30";Sandra
"Se abrio el formulario de Add_conductor ";"20/08/2019 18:05:36";
"Se abrio el formulario de Add_conductor ";"20/08/2019 18:06:06";
"Se guardo al conductor JESUS ARMANDO HERNANDEZ y se asigno la ruta 3";"2019/08/20 18:06:12";Sandra
"Se abrio el formulario de Add_conductor ";"20/08/2019 18:06:16";
"Se abrio la lista de Conductores ";"20/08/2019 18:06:34";
"Se guardo al conductor JOSE RICARDO PEREZ y se asigno la ruta 7";"2019/08/20 18:06:53";Sandra
"Se abrio el formulario de Add_conductor ";"20/08/2019 18:07:02";
"Se abrio la lista de Conductores ";"20/08/2019 18:07:12";
"Se guardo al conductor JUAN PABLO MORALES y se asigno la ruta 5";"2019/08/20 18:07:31";Sandra
"Se abrio la lista de Unidades ";"20/08/2019 18:08:56";
"Se abrio el formulario de Add_Unidad ";"20/08/2019 18:09:12";Sandra
"Inicio Sesion el usuario Cesar Samuel Rodriguez Hernandez";"2019/08/20 18:09:21";"Cesar Samuel Rodriguez Hernandez"
"Se abrio la lista de Conductores ";"20/08/2019 18:09:24";
"Se abrio la lista de Conductores ";"20/08/2019 18:09:38";
"Se abrio el formulario de Add_conductor ";"20/08/2019 18:10:25";
"Se abrio la lista de Conductores ";"20/08/2019 18:10:29";
"Se abrio la lista de Unidades ";"20/08/2019 18:10:48";
"Se abrio la lista de Conductores ";"20/08/2019 18:10:59";
"Se abrio la lista de Conductores ";"20/08/2019 18:11:12";Sandra
"Se abrio la lista de Conductores ";"20/08/2019 18:11:23";
"Se abrio la lista de Conductores ";"20/08/2019 18:11:27";Sandra
"Se abrio el formulario de Add_Unidad ";"20/08/2019 18:11:59";Sandra
"Se abrio la lista de Unidades ";"20/08/2019 18:12:34";
"Inicio Sesion el usuario Sandra Rosas";"2019/08/21 08:16:00";"Sandra Rosas"
"Se abrio la lista de Unidades ";"21/08/2019 08:16:07";
"Se abrio la lista de Conductores ";"21/08/2019 08:16:16";
"Se abrio la lista de Conductores ";"21/08/2019 08:16:39";Sandra
"Se abrio la lista de Unidades ";"21/08/2019 08:17:27";
"Se abrio el formulario de Add_Unidad ";"21/08/2019 08:17:30";Sandra
"Se abrio la lista de Unidades ";"21/08/2019 08:17:48";
"Se abrio el formulario de Add_Unidad ";"21/08/2019 08:18:19";Sandra
"Se guardo la Unidad 16";"2019/08/21 08:22:48";Sandra
"Se abrio el formulario de Add_Unidad ";"21/08/2019 08:22:52";Sandra
"Se guardo la Unidad 3";"2019/08/21 08:25:02";Sandra
"Se abrio la lista de Unidades ";"21/08/2019 08:25:09";
"Se abrio el formulario de Add_Unidad ";"21/08/2019 08:25:29";Sandra
"Se guardo la Unidad 29";"2019/08/21 08:27:43";Sandra
"Se abrio la lista de Unidades ";"21/08/2019 08:27:49";
"Se abrio la lista de Unidades ";"21/08/2019 08:27:49";
"Se abrio el formulario de Add_conductor ";"21/08/2019 08:28:02";
"Se abrio la lista de Conductores ";"21/08/2019 08:28:07";
"Se abrio el formulario de Add_Unidad ";"21/08/2019 08:28:53";Sandra
"Se abrio la lista de Conductores ";"21/08/2019 08:28:58";zamo
"Se guardo la Unidad 14";"2019/08/21 08:30:55";Sandra
"Se abrio el formulario de Add_Unidad ";"21/08/2019 08:30:59";Sandra
"Se abrio la lista de Unidades ";"21/08/2019 08:31:09";
"Se abrio el formulario de Add_Unidad ";"21/08/2019 09:02:10";Sandra
"Se abrio la lista de Unidades ";"21/08/2019 09:02:13";
"Se abrio el formulario de Add_Unidad ";"21/08/2019 09:14:54";Sandra
"Se guardo la Unidad 5";"2019/08/21 09:16:57";Sandra
"Se abrio la lista de Unidades ";"21/08/2019 09:17:02";
"Se abrio la lista de Conductores ";"21/08/2019 09:17:12";
"Se abrio la lista de Conductores ";"21/08/2019 09:17:25";Sandra
"Se abrio el formulario de Add_Unidad ";"21/08/2019 09:25:50";Sandra
"Se guardo la Unidad 32";"2019/08/21 09:27:36";Sandra
"Se abrio la lista de Unidades ";"21/08/2019 09:27:46";
"Se abrio el formulario de Add_Unidad ";"21/08/2019 09:28:13";Sandra
"Se guardo la Unidad 10";"2019/08/21 09:30:35";Sandra
"Se abrio la lista de Unidades ";"21/08/2019 09:30:40";
"Se abrio la lista de Unidades ";"21/08/2019 09:31:01";
"Se abrio el formulario de Add_Unidad ";"21/08/2019 09:31:05";Sandra
"Se guardo la Unidad 4";"2019/08/21 09:32:52";Sandra
"Se abrio la lista de Conductores ";"21/08/2019 11:12:23";
"Se abrio la lista de Conductores ";"21/08/2019 11:14:10";zamo
"Se abrio la lista de Unidades ";"21/08/2019 11:14:20";
"Se abrio la lista de Unidades ";"21/08/2019 11:14:41";zamo
"Se abrio la lista de Conductores ";"21/08/2019 11:16:55";zamo
"Se abrio el formulario de Add_Unidad ";"21/08/2019 11:17:08";zamo
"Inicio Sesion el usuario Sandra Rosas";"2019/08/21 11:27:40";"Sandra Rosas"
"Se abrio la lista de Conductores ";"21/08/2019 11:27:47";Sandra
"Se abrio el formulario de Add_Ruta ";"21/08/2019 11:28:25";Sandra
"Se abrio el formulario de Add_Unidad ";"21/08/2019 11:28:32";Sandra
"Se abrio el formulario de Add_Unidad ";"21/08/2019 12:56:34";zamo
"Inicio Sesion el usuario Cesar Samuel Rodriguez Hernandez";"2019/08/24 12:50:46";"Cesar Samuel Rodriguez Hernandez"
"Inicio Sesion el usuario Cesar Samuel Rodriguez Hernandez";"2019/08/26 09:50:49";"Cesar Samuel Rodriguez Hernandez"
"Inicio seleciono la unidad  2 Para dar una salida";"2019/08/26 09:50:58";zamo
"Inicio seleciono la unidad  2 Para dar una salida";"2019/08/26 09:52:33";zamo
"Se abrio el formulario de Add_Unidad ";"26/08/2019 09:56:07";zamo
"Se abrio la lista de Unidades ";"26/08/2019 09:56:10";zamo
"Inicio Sesion el usuario Cesar Samuel Rodriguez Hernandez";"2019/08/26 09:56:28";"Cesar Samuel Rodriguez Hernandez"
"Se abrio la lista de Unidades ";"26/08/2019 09:56:36";zamo
"Se abrio la lista de Conductores ";"26/08/2019 09:56:58";zamo
"Inicio Sesion el usuario Cesar Samuel Rodriguez Hernandez";"2019/08/26 09:57:08";"Cesar Samuel Rodriguez Hernandez"
"Se abrio la lista de Unidades ";"26/08/2019 09:57:16";zamo
"Se abrio la lista de Conductores ";"26/08/2019 09:58:33";zamo
"Inicio seleciono la unidad  2 Para dar una salida";"2019/08/26 09:58:56";zamo
"Inicio Sesion el usuario Cesar Samuel Rodriguez Hernandez";"2019/08/26 10:57:03";"Cesar Samuel Rodriguez Hernandez"
"Inicio Sesion el usuario Sandra Rosas";"2019/08/26 10:57:23";"Sandra Rosas"
"Inicio seleciono la unidad  2 Para dar una salida";"2019/08/26 10:57:46";Sandra
"Se abrio la lista de Unidades ";"26/08/2019 10:59:07";Sandra
"Se abrio el formulario de Add_Ruta ";"26/08/2019 11:01:00";Sandra
"Inicio Sesion el usuario Cesar Samuel Rodriguez Hernandez";"2019/08/28 17:15:24";"Cesar Samuel Rodriguez Hernandez"
"Inicio Sesion el usuario Cesar Samuel Rodriguez Hernandez";"2019/08/28 17:15:26";"Cesar Samuel Rodriguez Hernandez"
"Inicio seleciono la unidad  2 Para dar una salida";"2019/08/31 12:34:25";zamo
"Inicio seleciono la unidad  2 Para dar una salida";"2019/09/11 08:24:53";zamo
"Inicio Sesion el usuario Cesar Samuel Rodriguez Hernandez";"2019/09/17 08:42:21";"Cesar Samuel Rodriguez Hernandez"
"Inicio seleciono la unidad  2 Para dar una salida";"2019/09/18 10:21:02";zamo
"Inicio seleciono la unidad  2 Para dar una salida";"2019/09/18 10:26:52";zamo
"Inicio seleciono la unidad  2 Para dar una salida";"2019/09/18 10:42:58";zamo
"Inicio seleciono la unidad  2 Para dar una salida";"2019/09/18 10:44:02";zamo
"Inicio seleciono la unidad  2 Para dar una salida";"2019/09/18 10:44:17";zamo
"Inicio seleciono la unidad  2 Para dar una salida";"2019/09/18 10:44:44";zamo
"Inicio seleciono la unidad  2 Para dar una salida";"2019/09/18 10:45:01";zamo
"Inicio seleciono la unidad  2 Para dar una salida";"2019/09/18 10:45:15";zamo
"Inicio seleciono la unidad  2 Para dar una salida";"2019/09/18 10:48:06";zamo
"Inicio seleciono la unidad  2 Para dar una salida";"2019/09/18 10:48:36";zamo
"Inicio seleciono la unidad  2 Para dar una salida";"2019/09/18 10:49:05";zamo
"Inicio seleciono la unidad  2 Para dar una salida";"2019/09/18 10:49:19";zamo
"Inicio Sesion el usuario Cesar Samuel Rodriguez Hernandez";"2019/09/23 10:48:41";"Cesar Samuel Rodriguez Hernandez"
"Inicio seleciono la unidad  2 Para dar una salida";"2019/09/23 11:13:31";zamo
"Inicio seleciono la unidad  2 Para dar una salida";"2019/09/23 11:15:16";zamo
"Inicio Sesion el usuario Cesar Samuel Rodriguez Hernandez";"2019/09/23 11:15:30";"Cesar Samuel Rodriguez Hernandez"
"Inicio Sesion el usuario Cesar Samuel Rodriguez Hernandez";"2019/09/23 11:17:06";"Cesar Samuel Rodriguez Hernandez"
"Inicio seleciono la unidad  2 Para dar una salida";"2019/09/23 11:17:19";zamo
"Inicio Sesion el usuario Cesar Samuel Rodriguez Hernandez";"2019/09/23 11:18:08";"Cesar Samuel Rodriguez Hernandez"
"Inicio seleciono la unidad  2 Para dar una salida";"2019/09/23 11:18:47";zamo
"Inicio Sesion el usuario Cesar Samuel Rodriguez Hernandez";"2019/09/23 11:19:01";"Cesar Samuel Rodriguez Hernandez"
"Inicio seleciono la unidad  2 Para dar una salida";"2019/09/23 11:19:05";zamo
"Inicio seleciono la unidad  2 Para dar una salida";"2019/09/23 11:20:00";zamo
"Inicio seleciono la unidad  2 Para dar una salida";"2019/09/23 11:22:43";zamo
"Inicio seleciono la unidad  2 Para dar una salida";"2019/09/23 11:24:02";zamo
"Inicio seleciono la unidad  2 Para dar una salida";"2019/09/23 11:28:18";zamo
"Inicio seleciono la unidad  2 Para dar una salida";"2019/09/23 11:42:44";zamo
"Se abrio el formulario de Add_Unidad ";"23/09/2019 15:58:32";zamo
"Se abrio el formulario de Add_Ruta ";"23/09/2019 15:58:52";zamo
"Se abrio el formulario de Add_Ruta ";"23/09/2019 16:05:38";zamo
"Se abrio el formulario de Add_Ruta ";"23/09/2019 16:10:06";zamo
"Se abrio el formulario de Add_Ruta ";"23/09/2019 16:10:51";zamo
"Se abrio el formulario de Add_conductor ";"23/09/2019 16:16:42";
"Se abrio el formulario de Add_conductor ";"23/09/2019 16:17:31";
"Se abrio el formulario de Add_conductor ";"23/09/2019 16:17:44";
"Se abrio el formulario de Add_conductor ";"23/09/2019 16:26:14";
"Se abrio el formulario de Add_conductor ";"23/09/2019 16:26:36";
"Inicio Sesion el usuario Cesar Samuel Rodriguez Hernandez";"2019/09/23 16:26:45";"Cesar Samuel Rodriguez Hernandez"
"Se abrio el formulario de Add_conductor ";"23/09/2019 16:26:50";
"Se abrio el formulario de Add_Ruta ";"23/09/2019 16:26:57";
"Se abrio el formulario de Add_Ruta ";"23/09/2019 16:27:10";zamo
"Se abrio el formulario de Add_conductor ";"23/09/2019 16:27:15";
"Se abrio el formulario de Add_conductor ";"23/09/2019 16:27:37";zamo
"Se abrio el formulario de Add_Ruta ";"23/09/2019 16:28:16";zamo
"Se abrio el formulario de Add_conductor ";"23/09/2019 16:29:20";zamo
"Inicio Sesion el usuario Cesar Samuel Rodriguez Hernandez";"2019/09/23 16:31:23";"Cesar Samuel Rodriguez Hernandez"
"Se abrio el formulario de Add_conductor ";"23/09/2019 16:31:27";zamo
"Se abrio el formulario de Add_Unidad ";"23/09/2019 16:31:29";zamo
"Se abrio el formulario de Asig_Unidad ";"23/09/2019 16:32:43";zamo
"Se abrio el formulario de Asig_Unidad ";"23/09/2019 16:35:49";zamo
"Se abrio el formulario de Asig_Unidad ";"23/09/2019 16:36:22";zamo
"Se abrio el formulario de Asig_Unidad ";"23/09/2019 16:36:45";zamo
"Se abrio el formulario de Add_Unidad ";"23/09/2019 17:05:26";zamo
"Se abrio el formulario de Asig_Unidad ";"23/09/2019 17:05:28";zamo
"No se logro asignar la unidad 3 al conductor 11";"23/09/2019 17:05:47";zamo
"Se abrio el formulario de Asig_Unidad ";"23/09/2019 17:07:55";zamo
"No se logro asignar la unidad 3 al conductor 11";"23/09/2019 17:07:59";zamo
"Se abrio el formulario de Asig_Unidad ";"23/09/2019 17:11:54";zamo
"No se logro asignar la unidad 3 al conductor 11";"23/09/2019 17:11:58";zamo
"Se abrio el formulario de Asig_Unidad ";"23/09/2019 17:13:06";zamo
"Se asigno la unidad 3 al conductor 11";"23/09/2019 17:13:10";zamo
"Se abrio el formulario de Asig_Unidad ";"23/09/2019 17:13:21";zamo
"Se abrio el formulario de Asig_Unidad ";"23/09/2019 17:14:25";zamo
"Se asigno la unidad 3 al conductor 11";"23/09/2019 17:14:29";zamo
"Se abrio el formulario de Asig_Unidad ";"23/09/2019 17:14:34";zamo
"Se abrio el formulario de Add_Unidad ";"23/09/2019 17:14:40";zamo
"Inicio Sesion el usuario Cesar Samuel Rodriguez Hernandez";"23/09/2019 17:29:22";zamo
"Se abrio el formulario de Add_conductor ";"23/09/2019 17:29:26";zamo
"Se abrio el formulario de Asig_Unidad ";"23/09/2019 17:29:29";zamo
"Se abrio el formulario de Add_Unidad ";"23/09/2019 17:29:31";zamo
"ISe selecciono la la unidad 2 Para dar una salida";"23/09/2019 17:29:37";zamo
"ISe selecciono la la unidad 2 Para dar una salida";"23/09/2019 17:30:04";zamo
"Se abrio el formulario de Add_conductor ";"25/09/2019 10:49:58";zamo
"ISe selecciono la la unidad 3 Para dar una salida";"25/09/2019 17:01:38";zamo
"Se abrio el formulario de Asig_Unidad ";"27/09/2019 10:56:24";zamo
"Se abrio el formulario de Asig_Unidad ";"27/09/2019 10:58:33";zamo
"Se abrio el formulario de Asig_Unidad ";"27/09/2019 11:04:50";zamo
"Se abrio el formulario de Asig_Ruta ";"27/09/2019 11:14:48";zamo
"Se abrio la lista de Conductores ";"27/09/2019 11:15:51";zamo
"Se abrio el formulario de Asig_Ruta ";"27/09/2019 11:15:55";zamo
"Se abrio el formulario de Asig_Ruta ";"27/09/2019 12:25:16";zamo
"Se abrio el formulario de Asig_Ruta ";"27/09/2019 12:26:01";zamo
"Se abrio el formulario de Asig_Ruta ";"27/09/2019 12:26:34";zamo
"Se abrio el formulario de Asig_Ruta ";"27/09/2019 12:28:32";zamo
"No se logro asignar la unidad  al conductor 7";"27/09/2019 12:28:35";zamo
"Se abrio el formulario de Asig_Ruta ";"27/09/2019 12:29:17";zamo
"No se logro asignar la ruta 8 al conductor 7";"27/09/2019 12:29:20";zamo
"Se abrio el formulario de Asig_Ruta ";"27/09/2019 12:29:43";zamo
"Se abrio el formulario de Asig_Ruta ";"27/09/2019 12:30:03";zamo
"Se asigno la ruta 8 al conductor 7";"27/09/2019 12:30:07";zamo
"ISe selecciono la la unidad 2 Para dar una salida";"27/09/2019 12:43:00";zamo
"ISe selecciono la la unidad 3 Para dar una salida";"27/09/2019 12:43:29";zamo
"ISe selecciono la la unidad 2 Para dar una salida";"27/09/2019 12:44:33";zamo
"ISe selecciono la la unidad 3 Para dar una salida";"27/09/2019 12:48:30";zamo
"Inicio Sesion el usuario Sandra Rosas";"28/09/2019 09:45:27";Sandra
"ISe selecciono la la unidad 2 Para dar una salida";"28/09/2019 09:45:42";Sandra
"ISe selecciono la la unidad 3 Para dar una salida";"28/09/2019 09:46:12";Sandra
"Se abrio el formulario de Asig_Unidad ";"28/09/2019 09:46:32";Sandra
"Se abrio el formulario de Asig_Unidad ";"28/09/2019 09:46:44";Sandra
"Se abrio el formulario de Asig_Ruta ";"28/09/2019 09:46:48";Sandra
"Se abrio el formulario de Asig_Ruta ";"28/09/2019 09:47:00";Sandra
"Inicio Sesion el usuario Cesar Samuel Rodriguez Hernandez";"02/10/2019 17:23:50";zamo
"ISe selecciono la la unidad 3 Para dar una salida";"02/10/2019 17:31:33";zamo
"ISe selecciono la la unidad 3 Para dar una salida";"02/10/2019 17:32:33";zamo
"ISe selecciono la la unidad 3 Para dar una salida";"02/10/2019 17:32:52";zamo
"ISe selecciono la la unidad 3 Para dar una salida";"02/10/2019 17:39:16";zamo
"ISe selecciono la la unidad 3 Para dar una salida";"02/10/2019 17:39:43";zamo
"ISe selecciono la la unidad 3 Para dar una salida";"02/10/2019 17:52:15";zamo
"Se selecciono la la unidad 3 Para dar una salida";"02/10/2019 17:52:47";zamo
"Inicio Sesion el usuario Cesar Samuel Rodriguez Hernandez";"02/10/2019 17:54:58";zamo
"Se selecciono la la unidad 3 Para dar una salida";"02/10/2019 17:55:01";zamo
"Se selecciono la la unidad 3 Para dar una salida";"02/10/2019 17:58:11";zamo
"Se selecciono la la unidad 3 Para dar una salida";"02/10/2019 17:58:40";zamo
"Se selecciono la la unidad 3 Para dar una salida";"02/10/2019 17:58:56";zamo
"Se selecciono la la unidad 3 Para dar una salida";"02/10/2019 18:01:30";zamo
"Se selecciono la la unidad 3 Para dar una salida";"02/10/2019 18:02:39";zamo
"Se selecciono la la unidad 3 Para dar una salida";"03/10/2019 07:45:36";zamo
"Inicio Sesion el usuario Cesar Samuel Rodriguez Hernandez";"03/10/2019 10:19:22";zamo
"Se selecciono la la unidad 3 Para dar una salida";"03/10/2019 12:56:47";zamo
"Se selecciono la la unidad 3 Para dar una salida";"03/10/2019 13:17:01";zamo
"Se selecciono la la unidad 3 Para dar una salida";"03/10/2019 13:18:13";zamo
"Se selecciono la la unidad 3 Para dar una salida";"03/10/2019 13:18:47";zamo
"Se selecciono la la unidad 3 Para dar una salida";"03/10/2019 13:19:10";zamo
"Se selecciono la la unidad 3 Para dar una salida";"03/10/2019 13:19:26";zamo
"Inicio Sesion el usuario Cesar Samuel Rodriguez Hernandez";"03/10/2019 13:19:39";zamo
"Se selecciono la la unidad 3 Para dar una salida";"03/10/2019 13:22:46";zamo
"Se selecciono la la unidad 3 Para dar una salida";"03/10/2019 13:27:56";zamo
"Se selecciono la la unidad 3 Para dar una salida";"03/10/2019 13:28:58";zamo
"Se selecciono la la unidad 3 Para dar una salida";"03/10/2019 13:30:06";zamo
"Inicio Sesion el usuario Cesar Samuel Rodriguez Hernandez";"03/10/2019 13:32:39";zamo
"Inicio Sesion el usuario Cesar Samuel Rodriguez Hernandez";"03/10/2019 13:43:21";zamo
"Inicio Sesion el usuario Cesar Samuel Rodriguez Hernandez";"03/10/2019 16:03:55";zamo
"ISe selecciono la la unidad 3 Para dar una salida";"03/10/2019 16:05:57";zamo
"ISe selecciono la la unidad 3 Para dar una salida";"03/10/2019 16:06:45";zamo
"ISe selecciono la la unidad 3 Para dar una salida";"03/10/2019 16:08:25";zamo
"Se selecciono la la unidad 3 Para dar una salida";"03/10/2019 16:10:00";zamo
"Se selecciono la la unidad 3 Para dar una salida";"03/10/2019 16:11:01";zamo
"Se selecciono la la unidad 3 Para dar una salida";"03/10/2019 16:11:38";zamo
"Se selecciono la la unidad 3 Para dar una salida";"03/10/2019 16:13:19";zamo
"Se selecciono la la unidad 3 Para dar una salida";"03/10/2019 16:13:31";zamo
"Se selecciono la la unidad 3 Para dar una salida";"03/10/2019 16:14:35";zamo
"Se selecciono la la unidad 3 Para dar una salida";"03/10/2019 16:15:08";zamo
"Se selecciono la la unidad 3 Para dar una salida";"03/10/2019 16:24:35";zamo
"Se selecciono la la unidad 3 Para dar una salida";"03/10/2019 16:25:49";zamo
"Se selecciono la la unidad 3 Para dar una salida";"03/10/2019 16:26:23";zamo
"Se selecciono la la unidad 3 Para dar una salida";"03/10/2019 16:26:49";zamo
"Se selecciono la la unidad 3 Para dar una salida";"03/10/2019 16:27:07";zamo
"Se selecciono la la unidad 3 Para dar una salida";"03/10/2019 16:27:22";zamo
"Se selecciono la la unidad 3 Para dar una salida";"03/10/2019 16:27:37";zamo
"Se selecciono la la unidad 3 Para dar una salida";"03/10/2019 16:28:26";zamo
"Se selecciono la la unidad 3 Para dar una salida";"03/10/2019 16:29:48";zamo
"Se selecciono la la unidad 3 Para dar una salida";"03/10/2019 16:42:44";zamo
"Se selecciono la la unidad 3 Para dar una salida";"03/10/2019 16:45:46";zamo
"Se selecciono la la unidad 3 Para dar una salida";"03/10/2019 16:46:15";zamo
"Se selecciono la la unidad 3 Para dar una salida";"03/10/2019 16:48:42";zamo
"Se selecciono la la unidad 3 Para dar una salida";"03/10/2019 17:42:05";zamo
"Se selecciono la la unidad 3 Para dar una salida";"03/10/2019 17:43:20";zamo
"Se selecciono la la unidad 3 Para dar una salida";"03/10/2019 17:44:41";zamo
"Se selecciono la la unidad 3 Para dar una salida";"03/10/2019 17:45:20";zamo
"No se logro sacar la unidad  3 por algun problema";"2019/10/03 17:45:21";
"Se selecciono la la unidad 3 Para dar una salida";"03/10/2019 17:54:12";zamo
"Inicio Sesion el usuario Cesar Samuel Rodriguez Hernandez";"03/10/2019 17:54:32";zamo
"Se selecciono la la unidad 3 Para dar una salida";"03/10/2019 17:54:37";zamo
"Se selecciono la la unidad 3 Para dar una salida";"03/10/2019 17:56:03";zamo
"Se selecciono la la unidad 2 Para dar una salida";"03/10/2019 17:56:34";zamo
"Se selecciono la la unidad 3 Para dar una salida";"03/10/2019 17:57:14";zamo
"Se selecciono la la unidad 3 Para dar una salida";"03/10/2019 17:57:56";zamo
"Se selecciono la la unidad 3 Para dar una salida";"03/10/2019 17:58:10";zamo
"La unidad   Salio correctamente";"2019/10/03 17:58:12";
"Se selecciono la la unidad 3 Para dar una salida";"03/10/2019 18:03:54";zamo
"Se selecciono la la unidad 3 Para dar una salida";"03/10/2019 18:04:30";zamo
"Se selecciono la la unidad 3 Para dar una salida";"03/10/2019 18:05:05";zamo
"Inicio Sesion el usuario Cesar Samuel Rodriguez Hernandez";"03/10/2019 18:06:25";zamo
"Se selecciono la la unidad 3 Para dar una salida";"03/10/2019 18:06:28";zamo
"La unidad   Salio correctamente";"2019/10/03 18:06:40";zamo
"Se selecciono la la unidad 3 Para dar una salida";"03/10/2019 18:16:16";zamo
"La unidad   Salio correctamente";"2019/10/03 18:16:19";zamo
"Se selecciono la la unidad 3 Para dar una salida";"03/10/2019 18:18:26";zamo
"Se selecciono la la unidad 3 Para dar una salida";"03/10/2019 18:18:34";zamo
"Se selecciono la la unidad 3 Para dar una salida";"03/10/2019 18:19:02";zamo
"La unidad   Salio correctamente";"2019/10/03 18:19:05";zamo
"Se selecciono la la unidad 3 Para dar una salida";"03/10/2019 18:19:46";zamo
"Se selecciono la la unidad 3 Para dar una salida";"03/10/2019 18:20:03";zamo
"La unidad   Salio correctamente";"2019/10/03 18:20:05";zamo
"Se selecciono la la unidad 3 Para dar una salida";"03/10/2019 18:21:34";zamo
"La unidad  3 Salio correctamente";"2019/10/03 18:21:36";zamo
"Se selecciono la la unidad 2 Para dar una salida";"04/10/2019 08:06:28";zamo
"Se selecciono la la unidad 2 Para dar una salida";"04/10/2019 08:06:54";zamo
"Se selecciono la la unidad 2 Para dar una salida";"04/10/2019 08:10:18";zamo
"Se selecciono la la unidad 2 Para dar una salida";"04/10/2019 08:11:04";zamo
"Se selecciono la la unidad 2 Para dar una salida";"04/10/2019 08:12:10";zamo
"Se selecciono la la unidad 2 Para dar una salida";"04/10/2019 08:26:56";zamo
"Inicio Sesion el usuario Cesar Samuel Rodriguez Hernandez";"04/10/2019 16:39:23";zamo
"Se abrio el formulario de Add_conductor ";"04/10/2019 16:39:36";zamo
"Se abrio el formulario de Add_Unidad ";"04/10/2019 16:39:59";zamo
"Se abrio el formulario de Add_Ruta ";"04/10/2019 16:40:05";zamo
"Se selecciono la la unidad 2 Para dar una salida";"04/10/2019 16:40:47";zamo
"Se abrio la lista de Unidades ";"04/10/2019 16:41:23";zamo
"Se abrio la lista de Conductores ";"04/10/2019 16:41:40";zamo
"Se abrio la lista de Conductores ";"04/10/2019 16:41:46";
"Se abrio el formulario de Add_Unidad ";"04/10/2019 16:44:04";zamo
"Se abrio la lista de Unidades ";"04/10/2019 16:46:14";zamo
"Inicio Sesion el usuario Cesar Samuel Rodriguez Hernandez";"11/10/2019 10:55:37";zamo
"Se selecciono la la unidad 2 Para dar una salida";"11/10/2019 11:48:25";zamo
"Se selecciono la la unidad 6 Para dar una salida";"11/10/2019 11:53:54";zamo
"Se selecciono la la unidad 2 Para dar una salida";"11/10/2019 11:54:18";zamo
"Se selecciono la la unidad 6 Para dar una salida";"11/10/2019 11:54:24";zamo
"Se selecciono la la unidad 7 Para dar una salida";"11/10/2019 11:54:43";zamo
"Se selecciono la la unidad 8 Para dar una salida";"11/10/2019 11:55:03";zamo
"Se selecciono la la unidad 2 Para dar una salida";"11/10/2019 12:23:24";zamo
"Se selecciono la la unidad 8 Para dar una salida";"11/10/2019 12:23:28";zamo
"Se selecciono la la unidad 2 Para dar una salida";"11/10/2019 12:38:04";zamo
"Se selecciono la la unidad 2 Para dar una salida";"11/10/2019 12:41:27";zamo
"Se selecciono la la unidad 2 Para dar una salida";"11/10/2019 12:41:57";zamo
"Se selecciono la la unidad 2 Para dar una salida";"11/10/2019 12:42:17";zamo
"Se selecciono la la unidad 2 Para dar una salida";"11/10/2019 12:49:48";zamo
"Se selecciono la la unidad 6 Para dar una salida";"11/10/2019 12:50:04";zamo
"Se selecciono la la unidad 2 Para dar una salida";"11/10/2019 12:51:07";zamo
"Se selecciono la la unidad 7 Para dar una salida";"11/10/2019 12:51:10";zamo
"Se selecciono la la unidad 2 Para dar una salida";"11/10/2019 12:52:56";zamo
"La unidad  2 Salio correctamente";"2019/10/11 12:53:04";zamo
"Se selecciono la la unidad 5 Para dar una salida";"11/10/2019 12:55:20";zamo
"Se selecciono la la unidad 7 Para dar una salida";"11/10/2019 13:08:00";zamo
"Se selecciono la la unidad 2 Para dar retorno";"11/10/2019 13:27:54";zamo
"Se selecciono la la unidad 3 Para dar retorno";"11/10/2019 13:27:57";zamo
"Se selecciono la la unidad 2 Para dar retorno";"11/10/2019 13:38:04";zamo
"Se selecciono la la unidad 2 Para dar retorno";"11/10/2019 13:39:10";zamo
"Se selecciono la la unidad 3 Para dar retorno";"11/10/2019 13:40:28";zamo
"Se selecciono la la unidad 2 Para dar retorno";"11/10/2019 13:40:58";zamo
"Se selecciono la la unidad 3 Para dar retorno";"11/10/2019 13:41:03";zamo
"Se selecciono la la unidad 3 Para dar retorno";"11/10/2019 13:41:39";zamo
"Se selecciono la la unidad 2 Para dar retorno";"11/10/2019 13:42:22";zamo
"Se selecciono la la unidad 3 Para dar retorno";"11/10/2019 13:42:25";zamo
"Se selecciono la la unidad 3 Para dar retorno";"11/10/2019 13:43:05";zamo
"Se selecciono la la unidad 3 Para dar retorno";"11/10/2019 13:44:10";zamo
"Se selecciono la la unidad 3 Para dar retorno";"11/10/2019 13:45:11";zamo
"Se selecciono la la unidad 3 Para dar retorno";"11/10/2019 13:45:29";zamo
"Se selecciono la la unidad 3 Para dar retorno";"11/10/2019 13:45:50";zamo
"Se selecciono la la unidad 3 Para dar retorno";"11/10/2019 13:46:53";zamo
"Se selecciono la la unidad 3 Para dar retorno";"11/10/2019 13:47:38";zamo
"Se selecciono la la unidad 3 Para dar retorno";"11/10/2019 13:50:32";zamo
"Se selecciono la la unidad 3 Para dar retorno";"11/10/2019 16:29:16";zamo
"Se selecciono la la unidad 3 Para dar retorno";"11/10/2019 16:29:57";zamo
"Se selecciono la la unidad 3 Para dar retorno";"11/10/2019 16:55:42";zamo
"Se selecciono la la unidad 3 Para dar retorno";"11/10/2019 17:54:14";zamo
"Se realizo el regreso de la unidad 3 ";"11/10/2019 17:54:26";zamo
"Se selecciono la la unidad 2 Para dar retorno";"14/10/2019 17:22:45";zamo
"Se selecciono la la unidad 3 Para dar una salida";"14/10/2019 17:23:04";zamo
"Se selecciono la la unidad 3 Para dar una salida";"14/10/2019 17:23:17";zamo
"La unidad  3 Salio correctamente";"2019/10/14 17:23:23";zamo
"Se selecciono la la unidad 3 Para dar retorno";"14/10/2019 17:23:55";zamo
"Se realizo el regreso de la unidad 3 ";"14/10/2019 17:24:05";zamo
"Se selecciono la la unidad 3 Para dar una salida";"14/10/2019 17:24:30";zamo
"Se selecciono la la unidad 3 Para dar una salida";"14/10/2019 17:26:11";zamo
"La unidad  3 Salio correctamente";"2019/10/14 17:26:13";zamo
"Se selecciono la la unidad 3 Para dar retorno";"14/10/2019 17:26:28";zamo
"Se realizo el regreso de la unidad 3 ";"14/10/2019 17:26:38";zamo
"Se selecciono la la unidad 3 Para dar una salida";"14/10/2019 17:31:04";zamo
"La unidad  3 Salio correctamente";"2019/10/14 17:31:10";zamo
"Se selecciono la la unidad 3 Para dar retorno";"14/10/2019 17:31:16";zamo
"Se selecciono la la unidad 3 Para dar retorno";"14/10/2019 17:34:13";zamo
"Se realizo el regreso de la unidad 3 ";"14/10/2019 17:34:18";zamo
"Se selecciono la la unidad 3 Para dar una salida";"14/10/2019 17:35:03";zamo
"La unidad  3 Salio correctamente";"2019/10/14 17:35:05";zamo
"Se selecciono la la unidad 3 Para dar retorno";"14/10/2019 17:35:42";zamo
"Se realizo el regreso de la unidad 3 ";"14/10/2019 17:35:49";zamo
"Se selecciono la la unidad 3 Para dar una salida";"14/10/2019 17:36:19";zamo
"La unidad  3 Salio correctamente";"2019/10/14 17:36:21";zamo
"Se selecciono la la unidad 3 Para dar retorno";"14/10/2019 17:36:28";zamo
"Se selecciono la la unidad 3 Para dar retorno";"14/10/2019 17:36:45";zamo
"Se realizo el regreso de la unidad 3 ";"14/10/2019 17:36:52";zamo
"Se realizo el regreso de la unidad 3 ";"14/10/2019 17:37:38";zamo
"Se selecciono la la unidad 3 Para dar una salida";"14/10/2019 17:37:45";zamo
"La unidad  3 Salio correctamente";"2019/10/14 17:37:47";zamo
"Se selecciono la la unidad 3 Para dar retorno";"14/10/2019 17:38:07";zamo
"Se realizo el regreso de la unidad 3 ";"14/10/2019 17:38:14";zamo
"Se selecciono la la unidad 3 Para dar una salida";"14/10/2019 17:39:25";zamo
"La unidad  3 Salio correctamente";"2019/10/14 17:39:26";zamo
"Se selecciono la la unidad 3 Para dar retorno";"14/10/2019 17:39:35";zamo
"Se realizo el regreso de la unidad 3 ";"14/10/2019 17:39:43";zamo
"Se selecciono la la unidad 3 Para dar una salida";"14/10/2019 17:40:32";zamo
"La unidad  3 Salio correctamente";"2019/10/14 17:40:33";zamo
"Se selecciono la la unidad 3 Para dar retorno";"14/10/2019 17:40:40";zamo
"Se realizo el regreso de la unidad 3 ";"14/10/2019 17:40:49";zamo
"Se selecciono la la unidad 3 Para dar una salida";"14/10/2019 17:41:00";zamo
"Se selecciono la la unidad 8 Para dar una salida";"16/10/2019 17:14:14";zamo
"La unidad  8 Salio correctamente";"2019/10/16 17:14:36";zamo
"Inicio Sesion el usuario Isac Gonzales";"16/10/2019 17:32:54";Isac
"Se selecciono la la unidad 3 Para dar una salida";"16/10/2019 17:33:01";Isac
"Inicio Sesion el usuario Sandra Rosas";"16/10/2019 18:10:47";Sandra
"Inicio Sesion el usuario Sandra Rosas";"16/10/2019 18:10:48";Sandra
"Inicio Sesion el usuario Sandra Rosas";"16/10/2019 18:10:48";Sandra
"Inicio Sesion el usuario Sandra Rosas";"16/10/2019 18:10:51";Sandra
"Inicio Sesion el usuario Sandra Rosas";"16/10/2019 18:11:22";Sandra
"Se abrio el formulario de Add_Unidad ";"16/10/2019 18:13:03";Sandra
"Se guardo la Unidad 31";"2019/10/16 18:14:35";Sandra
"Inicio Sesion el usuario Cesar Samuel Rodriguez Hernandez";"17/10/2019 12:09:43";zamo
"Se selecciono la la unidad 13 Para dar una salida";"17/10/2019 12:10:24";zamo
"Se abrio el formulario de Add_conductor ";"17/10/2019 12:10:33";zamo
"Se abrio el formulario de Add_Unidad ";"17/10/2019 12:10:57";zamo
"Se abrio la lista de Conductores ";"17/10/2019 12:11:09";zamo
"Inicio Sesion el usuario Prueba";"17/10/2019 12:29:06";Prueba
"Inicio Sesion el usuario Cesar Samuel Rodriguez Hernandez";"17/10/2019 12:52:41";zamo
"Inicio Sesion el usuario Sandra Rosas";"17/10/2019 16:08:28";Sandra
"Se abrio el formulario de Add_conductor ";"17/10/2019 16:20:41";Sandra
"Se guardo al conductor Jonathan Giles Tinoco y se asigno la ruta 1";"2019/10/17 16:25:07";Sandra
"Se abrio la lista de Conductores ";"17/10/2019 16:25:23";Sandra
"Inicio Sesion el usuario Sandra Rosas";"17/10/2019 16:30:38";Sandra
"Inicio Sesion el usuario Sandra Rosas";"17/10/2019 16:30:38";Sandra
"Inicio Sesion el usuario Sandra Rosas";"17/10/2019 16:30:38";Sandra
"Inicio Sesion el usuario Sandra Rosas";"17/10/2019 16:30:39";Sandra
"Inicio Sesion el usuario Sandra Rosas";"17/10/2019 16:30:39";Sandra
"Se abrio la lista de Conductores ";"18/10/2019 11:00:08";zamo
"Se abrio la lista de Conductores ";"18/10/2019 11:28:05";zamo
"Se abrio la lista de Conductores ";"18/10/2019 11:28:46";zamo
"Se abrio la lista de Conductores ";"18/10/2019 11:35:11";zamo
"Se abrio la lista de Conductores ";"18/10/2019 11:37:12";zamo
"Se selecciono la la unidad 8 Para dar retorno";"18/10/2019 11:37:44";zamo
"Se realizo el regreso de la unidad 8 ";"18/10/2019 11:37:57";zamo
"Se abrio la lista de Conductores ";"18/10/2019 11:38:01";zamo
"Inicio Sesion el usuario Sandra Rosas";"18/10/2019 11:39:54";Sandra
"Se selecciono la la unidad 3 Para dar una salida";"18/10/2019 11:40:06";Sandra
"Se selecciono la la unidad 2 Para dar retorno";"18/10/2019 11:40:21";Sandra
"Se abrio la lista de Conductores ";"18/10/2019 11:40:41";Sandra
"Se abrio la lista de Conductores ";"18/10/2019 12:24:51";zamo
"Se abrio la lista de Conductores ";"18/10/2019 12:25:40";zamo
"Se abrio la lista de Conductores ";"18/10/2019 12:26:47";zamo
"Inicio Sesion el usuario Cesar Samuel Rodriguez Hernandez";"18/10/2019 12:29:26";zamo
"Se abrio la lista de Conductores ";"18/10/2019 12:29:28";zamo
"Se abrio la lista de Conductores ";"18/10/2019 13:29:35";zamo
"Se abrio la lista de Conductores ";"18/10/2019 13:30:16";zamo
"Se abrio la lista de Unidades ";"18/10/2019 16:20:44";Sandra
"Se abrio la lista de Conductores ";"18/10/2019 16:20:56";Sandra
"Se abrio el formulario de Asig_Unidad ";"18/10/2019 16:21:02";Sandra
"Inicio Sesion el usuario Sandra Rosas";"21/10/2019 08:42:43";Sandra
"Se abrio el formulario de Add_Unidad ";"21/10/2019 08:43:10";Sandra
"Se abrio la lista de Unidades ";"21/10/2019 08:43:15";Sandra
"Se abrio la lista de Conductores ";"21/10/2019 08:43:21";Sandra
"Inicio Sesion el usuario Cesar Samuel Rodriguez Hernandez";"21/10/2019 08:59:19";zamo
"Se abrio la lista de Conductores ";"21/10/2019 08:59:22";zamo
"Se abrio la lista de Conductores ";"21/10/2019 09:04:32";zamo
"Se abrio la lista de Conductores ";"21/10/2019 09:13:31";zamo
"Se selecciono la la unidad 3 Para dar una salida";"21/10/2019 09:44:58";zamo
"La unidad  3 Salio correctamente";"2019/10/21 09:44:59";zamo
"Se abrio la lista de Conductores ";"21/10/2019 09:45:03";zamo
"Se abrio la lista de Conductores ";"21/10/2019 09:48:05";zamo
"Se selecciono la la unidad 13 Para dar una salida";"21/10/2019 09:48:24";zamo
"Se selecciono la la unidad 13 Para dar una salida";"21/10/2019 09:52:39";zamo
"La unidad  13 Salio correctamente";"2019/10/21 09:52:46";zamo
"Se abrio la lista de Conductores ";"21/10/2019 09:52:50";zamo
"Inicio Sesion el usuario Sandra Rosas";"21/10/2019 09:55:58";Sandra
"Se abrio la lista de Conductores ";"21/10/2019 09:56:10";Sandra
"Se abrio la lista de Conductores ";"21/10/2019 09:56:17";Sandra
"Inicio Sesion el usuario Sandra Rosas";"21/10/2019 09:56:49";Sandra
"Se abrio la lista de Conductores ";"21/10/2019 09:56:52";Sandra
"Se abrio la lista de Conductores ";"21/10/2019 09:57:50";zamo
"Se abrio la lista de Conductores ";"21/10/2019 10:16:27";zamo
"Se abrio la lista de Conductores ";"21/10/2019 10:17:06";zamo
"Se abrio la lista de Conductores ";"21/10/2019 10:17:26";zamo
"Se abrio la lista de Conductores ";"21/10/2019 10:23:05";Sandra
"Se abrio la lista de Conductores ";"21/10/2019 11:27:41";zamo
"Se abrio la lista de Conductores ";"21/10/2019 16:44:25";zamo
"Se abrio la lista de Conductores ";"21/10/2019 16:46:48";zamo
"Se abrio la lista de Conductores ";"21/10/2019 16:47:29";zamo
"Se abrio la lista de Conductores ";"21/10/2019 16:47:47";zamo
"Se abrio la lista de Conductores ";"21/10/2019 16:48:07";zamo
"Se abrio la lista de Conductores ";"21/10/2019 16:49:31";zamo
"Se abrio la lista de Conductores ";"21/10/2019 16:49:49";zamo
"Se abrio la lista de Conductores ";"21/10/2019 16:50:36";zamo
"Se abrio la lista de Conductores ";"21/10/2019 16:50:54";zamo
"Se abrio la lista de Conductores ";"21/10/2019 16:54:28";zamo
"Se abrio la lista de Conductores ";"21/10/2019 16:54:47";zamo
"Se abrio la lista de Conductores ";"21/10/2019 16:56:19";zamo
"Se abrio la lista de Conductores ";"21/10/2019 16:56:57";zamo
"Se abrio la lista de Conductores ";"21/10/2019 16:57:44";zamo
"Inicio Sesion el usuario Cesar Samuel Rodriguez Hernandez";"21/10/2019 16:58:17";zamo
"Se abrio la lista de Conductores ";"21/10/2019 16:59:09";zamo
"Inicio Sesion el usuario Angelica Moreno";"21/10/2019 17:00:37";angelica
"Se abrio la lista de Conductores ";"21/10/2019 17:00:43";angelica
"Se abrio la lista de Conductores ";"21/10/2019 17:01:51";zamo
"Se abrio la lista de Conductores ";"21/10/2019 17:01:58";angelica
"Se abrio la lista de Conductores ";"21/10/2019 17:02:10";zamo
"Se abrio la lista de Conductores ";"21/10/2019 17:02:11";angelica
"Se abrio la lista de Conductores ";"21/10/2019 17:02:34";angelica
"Se abrio la lista de Conductores ";"21/10/2019 17:02:39";angelica
"Se abrio la lista de Conductores ";"21/10/2019 17:02:57";zamo
"Se abrio la lista de Conductores ";"21/10/2019 17:03:15";zamo
"Se abrio la lista de Conductores ";"21/10/2019 17:03:32";zamo
"Se abrio la lista de Conductores ";"21/10/2019 17:03:50";zamo
"Se abrio la lista de Conductores ";"21/10/2019 17:04:01";zamo
"Se abrio la lista de Conductores ";"21/10/2019 17:04:16";zamo
"Se abrio la lista de Conductores ";"21/10/2019 17:04:22";zamo
"Se abrio la lista de Conductores ";"21/10/2019 17:04:42";zamo
"Se abrio la lista de Conductores ";"21/10/2019 17:04:46";angelica
"Se abrio la lista de Conductores ";"21/10/2019 17:04:49";zamo
"Se selecciono la la unidad 8 Para dar una salida";"21/10/2019 17:05:22";zamo
"Se abrio la lista de Conductores ";"21/10/2019 17:05:31";zamo
"Se abrio la lista de Conductores ";"21/10/2019 17:05:37";zamo
"Se selecciono la la unidad 8 Para dar una salida";"21/10/2019 17:07:24";zamo
"La unidad  8 Salio correctamente";"2019/10/21 17:07:29";zamo
"Se abrio la lista de Conductores ";"21/10/2019 17:07:32";zamo
"Se abrio la lista de Conductores ";"21/10/2019 17:10:14";zamo
"Se abrio la lista de Conductores ";"21/10/2019 17:10:42";zamo
"Se abrio la lista de Conductores ";"21/10/2019 17:10:54";zamo
"Se abrio la lista de Conductores ";"21/10/2019 17:11:04";zamo
"Se abrio la lista de Conductores ";"21/10/2019 17:11:27";zamo
"Se abrio la lista de Conductores ";"21/10/2019 17:11:50";zamo
"Se abrio la lista de Conductores ";"21/10/2019 17:12:01";zamo
"Se abrio la lista de Conductores ";"21/10/2019 17:12:11";zamo
"Se abrio la lista de Conductores ";"21/10/2019 17:12:33";zamo
"Se abrio la lista de Conductores ";"21/10/2019 17:12:45";zamo
"Se abrio la lista de Conductores ";"21/10/2019 17:13:07";zamo
"Se abrio la lista de Conductores ";"21/10/2019 17:22:10";zamo
"Se selecciono la la unidad 3 Para dar retorno";"21/10/2019 17:22:27";zamo
"Se realizo el regreso de la unidad 3 ";"21/10/2019 17:22:41";zamo
"Se abrio la lista de Conductores ";"21/10/2019 17:22:44";zamo
"Se abrio la lista de Conductores ";"22/10/2019 07:51:50";zamo
"Inicio Sesion el usuario Sandra Rosas";"22/10/2019 10:38:53";Sandra
"Se abrio la lista de Conductores ";"22/10/2019 10:38:58";Sandra
"Se abrio la lista de Conductores ";"22/10/2019 10:39:18";Sandra
"Inicio Sesion el usuario Cesar Samuel Rodriguez Hernandez";"22/10/2019 10:39:27";zamo
"Se abrio la lista de Conductores ";"22/10/2019 10:39:31";zamo
"Se abrio la lista de Conductores ";"22/10/2019 10:39:38";Sandra
"Inicio Sesion el usuario Sandra Rosas";"22/10/2019 10:40:43";Sandra
"Inicio Sesion el usuario Sandra Rosas";"22/10/2019 10:41:56";Sandra
"Se abrio la lista de Conductores ";"22/10/2019 10:41:59";Sandra
"Se selecciono la la unidad 8 Para dar retorno";"22/10/2019 10:43:58";Sandra
"Se abrio la lista de Conductores ";"22/10/2019 10:47:24";Sandra
"Se abrio la lista de Conductores ";"22/10/2019 10:54:05";Sandra
"Inicio Sesion el usuario Cesar Samuel Rodriguez Hernandez";"22/10/2019 11:52:24";zamo
"Inicio Sesion el usuario Cesar Samuel Rodriguez Hernandez";"22/10/2019 11:58:52";zamo
"Se abrio la lista de Conductores ";"22/10/2019 12:11:32";zamo
"Se abrio la lista de Conductores ";"22/10/2019 12:12:05";zamo
"Se abrio la lista de Conductores ";"22/10/2019 12:12:56";zamo
"Se abrio la lista de Conductores ";"22/10/2019 12:13:59";zamo
"Se abrio la lista de Conductores ";"22/10/2019 12:14:11";zamo
"Se abrio la lista de Conductores ";"22/10/2019 12:18:10";zamo
"Se abrio el formulario de Add_Unidad ";"22/10/2019 12:25:28";zamo
"Se abrio el formulario de Add_Unidad ";"22/10/2019 12:27:24";zamo
"Se abrio la lista de Conductores ";"22/10/2019 12:35:25";zamo
"Se abrio el formulario de Add_Unidad ";"22/10/2019 12:39:00";zamo
"Se abrio el formulario de Reporte de salidas ";"22/10/2019 12:41:29";zamo
"Se abrio el formulario de Reporte de salidas ";"22/10/2019 12:41:44";zamo
"Se abrio el formulario de Add_conductor ";"22/10/2019 12:43:30";zamo
"Se abrio el formulario de Reporte de salidas ";"22/10/2019 12:43:30";zamo
"Se abrio el formulario de Add_conductor ";"22/10/2019 12:46:50";zamo
"Se abrio el formulario de Reporte de salidas ";"22/10/2019 12:46:50";zamo
"Se abrio el formulario de Add_conductor ";"22/10/2019 12:49:56";zamo
"Se abrio el formulario de Reporte de salidas ";"22/10/2019 12:49:56";zamo
"Se abrio el formulario de Add_conductor ";"22/10/2019 12:54:58";zamo
"Se abrio el formulario de Reporte de salidas ";"22/10/2019 12:54:58";zamo
"Se abrio el formulario de Add_conductor ";"22/10/2019 13:00:42";zamo
"Se abrio el formulario de Reporte de salidas ";"22/10/2019 13:00:42";zamo
"Se abrio el formulario de Add_conductor ";"22/10/2019 13:03:01";zamo
"Se abrio el formulario de Reporte de salidas ";"22/10/2019 13:03:01";zamo
"Se abrio el formulario de Add_conductor ";"22/10/2019 13:03:34";zamo
"Se abrio el formulario de Reporte de salidas ";"22/10/2019 13:03:34";zamo
"Se abrio el formulario de Add_conductor ";"22/10/2019 13:03:56";zamo
"Se abrio el formulario de Reporte de salidas ";"22/10/2019 13:03:56";zamo
"Se abrio el formulario de Add_conductor ";"22/10/2019 13:05:46";zamo
"Se abrio el formulario de Reporte de salidas ";"22/10/2019 13:05:46";zamo
"Se abrio el formulario de Add_conductor ";"22/10/2019 13:06:17";zamo
"Se abrio el formulario de Reporte de salidas ";"22/10/2019 13:06:17";zamo
"Se abrio el formulario de Add_conductor ";"22/10/2019 13:10:14";zamo
"Se abrio el formulario de Reporte de salidas ";"22/10/2019 13:10:14";zamo
"Se abrio el formulario de Add_conductor ";"22/10/2019 13:11:24";zamo
"Se abrio el formulario de Reporte de salidas ";"22/10/2019 13:11:24";zamo
"Se abrio el formulario de Add_conductor ";"22/10/2019 13:13:39";zamo
"Se abrio el formulario de Reporte de salidas ";"22/10/2019 13:13:39";zamo
"Se abrio el formulario de Add_conductor ";"22/10/2019 13:14:07";zamo
"Se abrio el formulario de Reporte de salidas ";"22/10/2019 13:14:07";zamo
"Inicio Sesion el usuario Isac Gonzales";"24/10/2019 09:40:20";Isac
"Inicio Sesion el usuario Isac Gonzales";"24/10/2019 09:42:15";Isac
"Se selecciono la la unidad 4 Para dar una salida";"24/10/2019 09:42:25";Isac
"Se selecciono la la unidad 3 Para dar una salida";"24/10/2019 09:42:27";Isac
"Se selecciono la la unidad 4 Para dar una salida";"24/10/2019 09:42:30";Isac
"Se selecciono la la unidad 3 Para dar una salida";"24/10/2019 09:42:34";Isac
"Se selecciono la la unidad 8 Para dar retorno";"24/10/2019 09:42:42";Isac
"Se abrio el formulario de Add_Unidad ";"24/10/2019 09:43:01";Isac
"Se abrio la lista de Unidades ";"24/10/2019 09:43:35";Isac
"Se abrio el formulario de Asig_Unidad ";"24/10/2019 09:44:32";Isac
"Se abrio el formulario de Add_conductor ";"24/10/2019 09:44:48";Isac
"Se abrio la lista de Conductores ";"24/10/2019 09:45:59";
"Se abrio la lista de Conductores ";"24/10/2019 09:46:02";Isac
"Se abrio el formulario de Add_Ruta ";"24/10/2019 09:46:36";Isac
"Se abrio la lista de Conductores ";"24/10/2019 09:46:57";
"Se abrio la lista de Conductores ";"24/10/2019 09:47:18";Isac
"Se abrio el formulario de Add_conductor ";"24/10/2019 09:48:44";Isac
"Se abrio el formulario de Reporte de salidas ";"24/10/2019 09:48:44";Isac
"Se abrio la lista de Conductores ";"24/10/2019 09:52:07";Isac
"Se abrio la lista de Conductores ";"24/10/2019 09:54:41";
"Se abrio el formulario de Add_Ruta ";"24/10/2019 09:57:12";Isac
"Se abrio el formulario de Add_Unidad ";"24/10/2019 09:58:26";Isac
"Se abrio la lista de Unidades ";"24/10/2019 09:58:38";Isac
"Se abrio la lista de Unidades ";"24/10/2019 13:05:57";Isac
"Se abrio el formulario de Add_Unidad ";"24/10/2019 13:23:17";Isac
"Se abrio la lista de Unidades ";"24/10/2019 13:23:59";Isac
"Se abrio el formulario de Add_Unidad ";"24/10/2019 13:24:13";Isac
"Se guardo la Unidad 1";"2019/10/24 13:28:42";Isac
"Se abrio la lista de Unidades ";"24/10/2019 13:28:52";Isac
"Se abrio el formulario de Add_Unidad ";"24/10/2019 13:29:53";Isac
"Se guardo la Unidad 6";"2019/10/24 13:33:34";Isac
"Se abrio el formulario de Add_Unidad ";"24/10/2019 13:34:25";Isac
"Se guardo la Unidad 8";"2019/10/24 13:38:44";Isac
"Se abrio la lista de Unidades ";"24/10/2019 13:38:52";Isac
"Se abrio el formulario de Add_Unidad ";"24/10/2019 13:39:13";Isac
"Se guardo la Unidad 9";"2019/10/24 13:42:31";Isac
"Se abrio la lista de Unidades ";"24/10/2019 13:42:43";Isac
"Se abrio el formulario de Add_Unidad ";"24/10/2019 13:43:10";Isac
"Se abrio el formulario de Asig_Unidad ";"24/10/2019 13:43:18";Isac
"Se asigno la unidad 11 al conductor 5";"24/10/2019 13:43:26";Isac
"Se abrio el formulario de Add_Unidad ";"24/10/2019 13:43:34";Isac
"Se guardo la Unidad 11";"2019/10/24 13:45:53";Isac
"Se abrio la lista de Unidades ";"24/10/2019 13:45:59";Isac
"Se abrio el formulario de Add_Unidad ";"24/10/2019 13:46:08";Isac
"Se guardo la Unidad 18";"2019/10/24 13:48:14";Isac
"Se abrio el formulario de Add_Unidad ";"24/10/2019 13:48:20";Isac
"Se guardo la Unidad 19";"2019/10/24 13:50:55";Isac
"Se abrio la lista de Unidades ";"24/10/2019 13:51:06";Isac
"Se abrio la lista de Unidades ";"24/10/2019 13:57:25";Isac
"Se abrio la lista de Unidades ";"24/10/2019 13:57:26";Isac
"Se abrio el formulario de Add_Unidad ";"24/10/2019 16:34:41";Isac
"Se abrio la lista de Unidades ";"24/10/2019 16:34:55";Isac
"Se abrio el formulario de Add_Unidad ";"24/10/2019 16:44:45";Isac
"Se guardo la Unidad 20";"2019/10/24 16:49:23";Isac
"Se abrio la lista de Unidades ";"24/10/2019 16:49:29";Isac
"Se abrio el formulario de Add_Unidad ";"24/10/2019 16:49:40";Isac
"Se guardo la Unidad 21";"2019/10/24 16:51:57";Isac
"Se abrio el formulario de Add_Unidad ";"24/10/2019 17:00:14";Isac
"Se guardo la Unidad 22";"2019/10/24 17:03:19";Isac
"Se abrio la lista de Unidades ";"24/10/2019 17:06:41";Isac
"Se abrio el formulario de Add_Unidad ";"24/10/2019 17:07:23";Isac
"Se guardo la Unidad 23";"2019/10/24 17:16:33";Isac
"Se abrio el formulario de Add_Unidad ";"24/10/2019 17:16:37";Isac
"Se guardo la Unidad 24";"2019/10/24 17:19:44";Isac
"Se abrio la lista de Unidades ";"24/10/2019 17:31:57";Isac
"Se abrio el formulario de Add_Unidad ";"24/10/2019 17:32:52";Isac
"Se guardo la Unidad 25";"2019/10/24 17:35:32";Isac
"Se abrio el formulario de Add_Unidad ";"24/10/2019 17:36:35";Isac
"Se guardo la Unidad 26";"2019/10/24 17:38:36";Isac
"Se abrio el formulario de Add_Unidad ";"24/10/2019 17:38:40";Isac
"Se guardo la Unidad 27";"2019/10/24 17:40:42";Isac
"Se abrio el formulario de Add_Unidad ";"24/10/2019 17:40:51";Isac
"Se guardo la Unidad 28";"2019/10/24 17:43:03";Isac
"Se abrio el formulario de Add_Unidad ";"24/10/2019 17:43:07";Isac
"Se guardo la Unidad 30";"2019/10/24 17:45:16";Isac
"Se abrio la lista de Unidades ";"24/10/2019 17:45:25";Isac
"Se abrio el formulario de Add_Unidad ";"24/10/2019 17:46:05";Isac
"Se guardo la Unidad 33";"2019/10/24 17:48:52";Isac
"Se abrio el formulario de Add_Unidad ";"24/10/2019 17:48:56";Isac
"Se guardo la Unidad 34";"2019/10/24 17:51:22";Isac
"Se abrio el formulario de Add_Unidad ";"24/10/2019 17:51:27";Isac
"Se abrio la lista de Unidades ";"24/10/2019 17:51:44";Isac
"Inicio Sesion el usuario Sandra Rosas";"25/10/2019 11:38:05";Sandra
"Inicio Sesion el usuario Isac Gonzales";"25/10/2019 11:38:06";Isac
"Se abrio la lista de Conductores ";"25/10/2019 11:38:11";Sandra
"Se abrio el formulario de Add_conductor ";"25/10/2019 11:38:58";Sandra
"Se abrio el formulario de Reporte de salidas ";"25/10/2019 11:38:58";Sandra
"Se abrio el formulario de Add_Unidad ";"25/10/2019 11:39:13";Sandra
"Se abrio la lista de Unidades ";"25/10/2019 11:39:17";Sandra
"Se abrio la lista de Conductores ";"25/10/2019 11:40:34";
"Se abrio la lista de Conductores ";"25/10/2019 11:40:50";Sandra
"Se abrio la lista de Unidades ";"25/10/2019 11:53:36";Isac
"Se abrio el formulario de Add_Unidad ";"25/10/2019 11:53:39";Isac
"Se abrio la lista de Unidades ";"25/10/2019 11:53:51";Isac
"Se abrio el formulario de Add_Unidad ";"25/10/2019 11:54:39";Isac
"Se guardo la Unidad 35";"2019/10/25 11:56:43";Isac
"Se abrio el formulario de Asig_Unidad ";"25/10/2019 11:56:54";Isac
"Se abrio el formulario de Add_Unidad ";"25/10/2019 11:57:09";Isac
"Se guardo la Unidad 36";"2019/10/25 12:07:50";Isac
"Se abrio el formulario de Add_Unidad ";"25/10/2019 12:07:54";Isac
"Se guardo la Unidad 37";"2019/10/25 12:10:02";Isac
"Se abrio el formulario de Add_Unidad ";"25/10/2019 12:10:07";Isac
"Se guardo la Unidad 13";"2019/10/25 12:11:54";Isac
"Se abrio el formulario de Add_Unidad ";"25/10/2019 12:12:53";Isac
"Se guardo la Unidad 15";"2019/10/25 12:15:31";Isac
"Se abrio el formulario de Add_Unidad ";"25/10/2019 12:16:06";Isac
"Se guardo la Unidad 15-N";"2019/10/25 12:19:59";Isac
"Se abrio el formulario de Add_Unidad ";"25/10/2019 12:21:19";Isac
"Se guardo la Unidad 17";"2019/10/25 12:24:35";Isac
"Se abrio la lista de Unidades ";"25/10/2019 12:24:39";Isac
"Se abrio el formulario de Add_Unidad ";"25/10/2019 12:24:57";Isac
"Se abrio la lista de Unidades ";"25/10/2019 12:25:16";Isac
"Se abrio la lista de Unidades ";"25/10/2019 16:11:39";Isac
"Se abrio el formulario de Add_conductor ";"25/10/2019 16:55:38";Isac
"Se guardo al conductor ABDON DOMINGUEZ PALACIOS y se asigno la ruta 1";"2019/10/25 16:57:40";Isac
"Se abrio el formulario de Add_conductor ";"25/10/2019 16:58:02";Isac
"Se guardo al conductor ALICIA LOPEZ AGUILAR y se asigno la ruta 1";"2019/10/25 16:59:55";Isac
"Se abrio la lista de Conductores ";"25/10/2019 17:00:24";Isac
"Se abrio el formulario de Add_conductor ";"25/10/2019 17:02:21";Isac
"Se guardo al conductor ANGELICA MORENO CONTRERAS y se asigno la ruta 1";"2019/10/25 17:03:27";Isac
"Se abrio el formulario de Add_conductor ";"25/10/2019 17:03:32";Isac
"Se abrio la lista de Unidades ";"25/10/2019 17:07:39";Isac
"Se abrio la lista de Conductores ";"25/10/2019 17:20:23";
"Se abrio la lista de Conductores ";"25/10/2019 17:21:07";Isac
"Inicio Sesion el usuario Isac Gonzales";"26/10/2019 10:33:03";Isac
"Se abrio el formulario de Add_conductor ";"26/10/2019 13:40:30";Isac
"Se guardo al conductor EDER SIDARTHA LOPEZ y se asigno la ruta 1";"2019/10/26 13:41:45";Isac
"Se abrio el formulario de Add_conductor ";"26/10/2019 13:41:54";Isac
"Se guardo al conductor GERSON ZILLI y se asigno la ruta 1";"2019/10/26 13:42:45";Isac
"Se abrio el formulario de Add_conductor ";"26/10/2019 13:42:49";Isac
"Se guardo al conductor GUSTAVO HUERTA  y se asigno la ruta 1";"2019/10/26 13:43:42";Isac
"Se abrio el formulario de Add_conductor ";"26/10/2019 13:43:46";Isac
"Se guardo al conductor HECTOR BARRERA EZQUIVEL y se asigno la ruta 1";"2019/10/26 13:47:36";Isac
"Se abrio el formulario de Add_conductor ";"26/10/2019 13:47:42";Isac
"Se guardo al conductor HUMBERTO MARTINEZ SALINAS y se asigno la ruta 1";"2019/10/26 13:48:41";Isac
"Se abrio la lista de Conductores ";"26/10/2019 15:57:19";Isac
"Se abrio el formulario de Add_conductor ";"26/10/2019 15:57:39";Isac
"Se guardo al conductor ISAAC JOSUE GONZALEZ GRANADOS y se asigno la ruta 1";"2019/10/26 15:58:51";Isac
"Se abrio el formulario de Add_conductor ";"26/10/2019 15:58:58";Isac
"Se guardo al conductor JESUS FERNANDO ALCANTARA RODRIGUEZ y se asigno la ruta 1";"2019/10/26 16:09:39";Isac
"Se abrio el formulario de Add_conductor ";"26/10/2019 16:09:45";Isac
"Se guardo al conductor JSOUE ALBERTO REYES DE LOS SANTOS y se asigno la ruta 1";"2019/10/26 16:11:16";Isac
"Se abrio el formulario de Add_conductor ";"26/10/2019 16:11:41";Isac
"Se guardo al conductor JOSE IGNACIO PE칌A PEREZ y se asigno la ruta 1";"2019/10/26 16:13:04";Isac
"Se abrio el formulario de Add_conductor ";"26/10/2019 16:24:38";Isac
"Se guardo al conductor JUAN CARLOS JIMENEZ VELEZ y se asigno la ruta 1";"2019/10/26 16:25:34";Isac
"Se abrio el formulario de Add_conductor ";"26/10/2019 16:25:39";Isac
"Se guardo al conductor LUIS DANIEL BOLA칌OS AGUIRRE y se asigno la ruta 1";"2019/10/26 16:26:39";Isac
"Se abrio el formulario de Add_conductor ";"26/10/2019 16:28:31";Isac
"Se guardo al conductor MARCOS SOLIS HERNANDEZ y se asigno la ruta 1";"2019/10/26 16:29:08";Isac
"Se abrio la lista de Conductores ";"26/10/2019 16:29:14";Isac
"Se abrio la lista de Conductores ";"26/10/2019 16:33:40";Isac
"Se abrio la lista de Conductores ";"26/10/2019 16:33:49";Isac
"Se abrio el formulario de Add_conductor ";"26/10/2019 16:33:52";Isac
"Se guardo al conductor MARIANO ALBERTO DIAZ EUGENIO y se asigno la ruta 1";"2019/10/26 16:34:37";Isac
"Se abrio el formulario de Add_conductor ";"26/10/2019 16:38:32";Isac
"Se guardo al conductor MARTIN SEGURA MENDOZA y se asigno la ruta 1";"2019/10/26 16:39:28";Isac
"Se abrio la lista de Conductores ";"26/10/2019 16:44:10";Isac
"Se abrio el formulario de Add_conductor ";"26/10/2019 16:44:30";Isac
"Se guardo al conductor NOE GOMEZ APARICIO y se asigno la ruta 1";"2019/10/26 16:52:15";Isac
"Se abrio el formulario de Add_conductor ";"26/10/2019 16:54:55";Isac
"Se guardo al conductor OSCAR GUTIERREZ TAGLE  y se asigno la ruta 1";"2019/10/26 16:55:47";Isac
"Se abrio la lista de Conductores ";"26/10/2019 17:04:18";Isac
"Se abrio el formulario de Add_conductor ";"26/10/2019 17:04:38";Isac
"Se guardo al conductor PEDRO JUAREZ SANCHEZ  y se asigno la ruta 1";"2019/10/26 17:05:32";Isac
"Se abrio el formulario de Add_conductor ";"26/10/2019 17:17:06";Isac
"Se guardo al conductor PROSPERO LUNA UBERA y se asigno la ruta 1";"2019/10/26 17:17:54";Isac
"Se abrio el formulario de Add_conductor ";"26/10/2019 17:18:06";Isac
"Se guardo al conductor RAUL SOSA ALEMAN y se asigno la ruta 1";"2019/10/26 17:18:32";Isac
"Se abrio la lista de Conductores ";"26/10/2019 17:18:54";Isac
"Se abrio la lista de Conductores ";"26/10/2019 17:19:29";Isac
"Se abrio el formulario de Add_conductor ";"26/10/2019 17:19:31";Isac
"Se guardo al conductor RENE ANTONIO GARCIA VAZQUEZ y se asigno la ruta 1";"2019/10/26 17:20:19";Isac
"Se abrio el formulario de Add_conductor ";"26/10/2019 17:20:38";Isac
"Se guardo al conductor ADRIAN VICTORIA ILLESCAS y se asigno la ruta 1";"2019/10/26 17:21:18";Isac
"Se abrio el formulario de Add_conductor ";"26/10/2019 17:21:31";Isac
"Se guardo al conductor AGUSTIN ORDU칌A MARTINEZ y se asigno la ruta 1";"2019/10/26 17:22:11";Isac
"Se abrio el formulario de Add_conductor ";"26/10/2019 17:22:21";Isac
"Se guardo al conductor ELISEO DIMAS MENDOZA y se asigno la ruta 1";"2019/10/26 17:23:00";Isac
"Se abrio el formulario de Add_conductor ";"26/10/2019 17:23:10";Isac
"Se guardo al conductor GUILLERMO DOMINGUEZ MEDINA  y se asigno la ruta 1";"2019/10/26 17:23:48";Isac
"Se abrio el formulario de Add_conductor ";"26/10/2019 17:23:59";Isac
"Se guardo al conductor JOSE LUIS ALTAMIRA CUE y se asigno la ruta 1";"2019/10/26 17:24:35";Isac
"Se abrio el formulario de Add_conductor ";"26/10/2019 17:24:41";Isac
"Se guardo al conductor NATALY MU칌OZ GALICIA y se asigno la ruta 1";"2019/10/26 17:25:29";Isac
"Se abrio el formulario de Add_conductor ";"26/10/2019 17:25:46";Isac
"Se guardo al conductor BALTASAR SANCHEZ REGULES y se asigno la ruta 1";"2019/10/26 17:29:28";Isac
"Se abrio la lista de Conductores ";"26/10/2019 17:29:33";Isac
"Inicio Sesion el usuario Isac Gonzales";"28/10/2019 15:30:39";Isac
"Se abrio la lista de Unidades ";"28/10/2019 15:30:51";Isac
"Inicio Sesion el usuario Sandra Rosas";"28/10/2019 16:14:27";Sandra
"Se abrio el formulario de Add_conductor ";"28/10/2019 16:15:56";Sandra
"Se abrio el formulario de Asig_Unidad ";"28/10/2019 16:27:46";Sandra
"Se abrio la lista de Conductores ";"28/10/2019 16:28:16";
"Se abrio el formulario de Add_conductor ";"28/10/2019 16:28:23";Sandra
"Se abrio el formulario de Reporte de salidas ";"28/10/2019 16:28:23";Sandra
"Se abrio la lista de Conductores ";"28/10/2019 16:34:24";Sandra
"Se abrio el formulario de Asig_Ruta ";"28/10/2019 16:34:39";Sandra
"Se abrio el formulario de Asig_Unidad ";"28/10/2019 16:37:59";Sandra
"Inicio Sesion el usuario Isac Gonzales";"29/10/2019 09:06:16";Isac
"Se abrio la lista de Conductores ";"29/10/2019 11:18:28";Isac
"Se abrio la lista de Unidades ";"29/10/2019 16:03:43";Isac
"Se abrio la lista de Unidades ";"29/10/2019 16:04:02";Isac
"Se selecciono la la unidad 10 Para dar una salida";"29/10/2019 16:04:17";Isac
"Inicio Sesion el usuario Isac Gonzales";"30/10/2019 09:29:20";Isac
"Inicio Sesion el usuario Isac Gonzales";"31/10/2019 09:06:51";Isac
"Inicio Sesion el usuario Isac Gonzales";"01/11/2019 09:10:47";Isac
"Inicio Sesion el usuario Isac Gonzales";"02/11/2019 08:17:40";Isac
"Se abrio la lista de Conductores ";"02/11/2019 13:20:33";Isac
"Se abrio la lista de Unidades ";"02/11/2019 13:20:54";Isac
"Inicio Sesion el usuario Isac Gonzales";"04/11/2019 13:45:52";Isac
"Inicio Sesion el usuario Isac Gonzales";"05/11/2019 16:40:01";Isac
"Inicio Sesion el usuario Isac Gonzales";"06/11/2019 09:15:20";Isac
"Se abrio la lista de Unidades ";"06/11/2019 09:15:28";Isac
"Se abrio la lista de Conductores ";"06/11/2019 09:15:44";Isac
"Inicio Sesion el usuario Isac Gonzales";"07/11/2019 09:23:25";Isac
"Inicio Sesion el usuario Isac Gonzales";"08/11/2019 10:35:13";Isac
"Inicio Sesion el usuario Isac Gonzales";"09/11/2019 09:04:32";Isac
"Inicio Sesion el usuario Isac Gonzales";"11/11/2019 09:06:22";Isac
"Inicio Sesion el usuario Isac Gonzales";"12/11/2019 09:18:13";Isac
"Inicio Sesion el usuario Isac Gonzales";"13/11/2019 09:22:26";Isac
"Inicio Sesion el usuario Cesar Samuel Rodriguez Hernandez";"15/11/2019 09:55:40";zamo
"Inicio Sesion el usuario Cesar Samuel Rodriguez Hernandez";"15/11/2019 09:55:40";zamo
"Inicio Sesion el usuario Cesar Samuel Rodriguez Hernandez";"15/11/2019 09:55:40";zamo
"Inicio Sesion el usuario Cesar Samuel Rodriguez Hernandez";"15/11/2019 09:55:40";zamo
"Inicio Sesion el usuario Cesar Samuel Rodriguez Hernandez";"15/11/2019 09:55:40";zamo
"Inicio Sesion el usuario Cesar Samuel Rodriguez Hernandez";"15/11/2019 09:55:40";zamo
"Inicio Sesion el usuario Cesar Samuel Rodriguez Hernandez";"15/11/2019 09:55:40";zamo
"Inicio Sesion el usuario Cesar Samuel Rodriguez Hernandez";"15/11/2019 09:55:40";zamo
"Inicio Sesion el usuario Cesar Samuel Rodriguez Hernandez";"15/11/2019 09:55:40";zamo
"Inicio Sesion el usuario Cesar Samuel Rodriguez Hernandez";"15/11/2019 09:55:40";zamo
"Se abrio la lista de Unidades ";"15/11/2019 10:17:04";zamo
"Se abrio el formulario de Add_conductor ";"15/11/2019 10:17:09";zamo
"Se abrio el formulario de Add_Ruta ";"15/11/2019 10:17:13";zamo
"Se abrio la lista de Conductores ";"15/11/2019 10:17:18";zamo
"Se abrio la lista de Conductores ";"15/11/2019 10:20:21";zamo
"Se abrio la lista de Conductores ";"15/11/2019 10:20:45";zamo
"Se abrio el formulario de Asig_Unidad ";"15/11/2019 10:21:03";zamo
"Se abrio el formulario de Asig_Ruta ";"15/11/2019 10:21:07";zamo
"Se abrio el formulario de Add_Unidad ";"15/11/2019 10:23:48";zamo
"Se abrio el formulario de Asig_Unidad ";"15/11/2019 10:23:59";zamo
"Se abrio el formulario de Add_conductor ";"15/11/2019 10:24:43";zamo
"Se abrio la lista de Conductores ";"15/11/2019 10:24:45";zamo
"Se abrio el formulario de Asig_Ruta ";"15/11/2019 10:24:51";zamo
"Inicio Sesion el usuario Cesar Samuel Rodriguez Hernandez";"15/11/2019 10:25:42";zamo
"Se selecciono la la unidad 3 Para dar una salida";"15/11/2019 10:25:49";zamo
"Se selecciono la la unidad 3 Para dar una salida";"15/11/2019 10:26:27";zamo
"Se selecciono la la unidad 2 Para dar retorno";"15/11/2019 10:26:33";zamo
"Se selecciono la la unidad 8 Para dar retorno";"15/11/2019 10:26:35";zamo
"Se selecciono la la unidad 13 Para dar retorno";"15/11/2019 10:26:37";zamo
"Inicio Sesion el usuario Cesar Samuel Rodriguez Hernandez";"15/11/2019 10:46:28";zamo
"Se selecciono la la unidad 3 Para dar una salida";"15/11/2019 10:46:35";zamo
"Se abrio el formulario de Add_conductor ";"15/11/2019 10:46:39";zamo
"Se abrio el formulario de Add_Ruta ";"15/11/2019 10:46:43";zamo
"Se abrio la lista de Conductores ";"15/11/2019 10:46:46";zamo
"Inicio Sesion el usuario Angelica Moreno";"15/11/2019 11:24:57";angelica
"Inicio Sesion el usuario Cesar Samuel Rodriguez Hernandez";"15/11/2019 17:40:12";zamo
"Se selecciono la la unidad 3 Para dar una salida";"15/11/2019 17:40:21";zamo
"Inicio Sesion el usuario Cesar Samuel Rodriguez Hernandez";"15/11/2019 17:45:59";zamo
"Se abrio la lista de Conductores ";"15/11/2019 17:46:03";zamo
"Inicio Sesion el usuario Sandra Rosas";"20/11/2019 03:34:45";Sandra
"Inicio Sesion el usuario Cesar Samuel Rodriguez Hernandez";"06/01/2020 05:33:47";zamo
